website,loc,lastmod,cured_name,type
www.kevinrchant.com,https://www.kevinrchant.com/,2025-03-19,,blog
www.kevinrchant.com,https://www.kevinrchant.com/2019/08/28/finding-sql-server-versions-for-docker-and-linux-using-a-web-browser/,2019-08-29,finding sql server versions for docker and linux using a web browser,blog
www.kevinrchant.com,https://www.kevinrchant.com/2019/10/14/speaking-at-sql-saturday-sofia/,2019-10-14,speaking at sql saturday sofia,blog
www.kevinrchant.com,https://www.kevinrchant.com/2019/10/16/challenging-yourself-at-conferences/,2019-10-16,challenging yourself at conferences,blog
www.kevinrchant.com,https://www.kevinrchant.com/2019/10/23/using-azure-data-studio-insiders-build/,2019-10-23,using azure data studio insiders build,blog
www.kevinrchant.com,https://www.kevinrchant.com/2019/10/28/being-sql-server-product-owner/,2019-10-28,being sql server product owner,blog
www.kevinrchant.com,https://www.kevinrchant.com/2019/11/12/t-sql-tuesday-120-severely-neglected-index/,2019-11-12,t sql tuesday 120 severely neglected index,blog
www.kevinrchant.com,https://www.kevinrchant.com/2019/12/16/setting-realistic-expectations/,2019-12-16,setting realistic expectations,blog
www.kevinrchant.com,https://www.kevinrchant.com/2019/12/20/personal-2019-review/,2019-12-20,personal 2019 review,blog
www.kevinrchant.com,https://www.kevinrchant.com/2019/12/30/looking-back-at-last-decade/,2020-01-11,looking back at last decade,blog
www.kevinrchant.com,https://www.kevinrchant.com/2020/01/14/t-sql-tuesday-122-imposter-syndrome/,2020-01-14,t sql tuesday 122 imposter syndrome,blog
www.kevinrchant.com,https://www.kevinrchant.com/2019/11/19/significant-azure-data-studio-update/,2020-01-21,significant azure data studio update,blog
www.kevinrchant.com,https://www.kevinrchant.com/2020/02/03/speaking-at-sql-saturday-edinburgh/,2020-02-04,speaking at sql saturday edinburgh,blog
www.kevinrchant.com,https://www.kevinrchant.com/2020/02/11/t-sql-tuesday-123-favourite-sql-server-life-hack/,2020-02-11,t sql tuesday 123 favourite sql server life hack,blog
www.kevinrchant.com,https://www.kevinrchant.com/2020/03/10/t-sql-tuesday-124-turning-query-store-on-everywhere/,2020-03-10,t sql tuesday 124 turning query store on everywhere,blog
www.kevinrchant.com,https://www.kevinrchant.com/2020/03/15/everybody-has-different-levels-of-stress/,2020-03-15,everybody has different levels of stress,blog
www.kevinrchant.com,https://www.kevinrchant.com/2020/03/17/recommended-azure-sql-database-learning-resources/,2020-03-17,recommended azure sql database learning resources,blog
www.kevinrchant.com,https://www.kevinrchant.com/2020/03/30/first-online-party-with-friends-experience/,2020-03-30,first online party with friends experience,blog
www.kevinrchant.com,https://www.kevinrchant.com/2020/04/01/interesting-azure-devops-extension-workaround/,2020-04-01,interesting azure devops extension workaround,blog
www.kevinrchant.com,https://www.kevinrchant.com/2020/04/09/data-community-weekender-europe-call-for-speakers/,2020-04-09,data community weekender europe call for speakers,blog
www.kevinrchant.com,https://www.kevinrchant.com/2020/04/13/data-community-weekender-europe-updates/,2020-04-13,data community weekender europe updates,blog
www.kevinrchant.com,https://www.kevinrchant.com/2020/04/14/t-sql-tuesday-125-unit-testing-database-changes/,2020-04-14,t sql tuesday 125 unit testing database changes,blog
www.kevinrchant.com,https://www.kevinrchant.com/2020/04/22/schedule-for-data-community-weekender-europe-now-live/,2020-04-22,schedule for data community weekender europe now live,blog
www.kevinrchant.com,https://www.kevinrchant.com/2020/04/25/online-events-are-important-right-now/,2020-04-25,online events are important right now,blog
www.kevinrchant.com,https://www.kevinrchant.com/2020/05/06/some-things-other-than-a-dataweekender-review/,2020-05-06,some things other than a dataweekender review,blog
www.kevinrchant.com,https://www.kevinrchant.com/2020/05/12/t-sql-tuesday-126-organizing-dataweekender/,2020-05-12,t sql tuesday 126 organizing dataweekender,blog
www.kevinrchant.com,https://www.kevinrchant.com/2020/05/20/ten-comments-i-think-every-sql-server-dba-wants-to-say/,2020-05-20,ten comments i think every sql server dba wants to say,blog
www.kevinrchant.com,https://www.kevinrchant.com/2020/05/27/azure-devops-retrospective-extension-is-staying/,2020-05-27,azure devops retrospective extension is staying,blog
www.kevinrchant.com,https://www.kevinrchant.com/2020/06/22/thoughts-about-sql-server-index-fragmentation-recommendations/,2020-06-23,thoughts about sql server index fragmentation recommendations,blog
www.kevinrchant.com,https://www.kevinrchant.com/2020/07/06/providing-feedback-to-microsoft-can-work/,2020-07-06,providing feedback to microsoft can work,blog
www.kevinrchant.com,https://www.kevinrchant.com/2020/07/13/loving-microsoft-teams-right-now/,2020-07-13,loving microsoft teams right now,blog
www.kevinrchant.com,https://www.kevinrchant.com/2020/07/21/july-2020-azure-data-studio-update/,2020-07-21,july 2020 azure data studio update,blog
www.kevinrchant.com,https://www.kevinrchant.com/2020/07/27/issues-if-renaming-your-main-git-branch-in-azure-devops/,2020-07-27,issues if renaming your main git branch in azure devops,blog
www.kevinrchant.com,https://www.kevinrchant.com/2020/08/03/dataweekender-call-for-attendees/,2020-08-03,dataweekender call for attendees,blog
www.kevinrchant.com,https://www.kevinrchant.com/2020/08/10/thoughts-about-sqlbits-going-virtual/,2020-08-10,thoughts about sqlbits going virtual,blog
www.kevinrchant.com,https://www.kevinrchant.com/2020/08/11/t-sql-tuesday-129-sql-community-time-capsule/,2020-08-11,t sql tuesday 129 sql community time capsule,blog
www.kevinrchant.com,https://www.kevinrchant.com/2020/08/17/dataweekender-is-an-inclusive-event/,2020-08-17,dataweekender is an inclusive event,blog
www.kevinrchant.com,https://www.kevinrchant.com/2020/08/19/looking-at-the-bigger-picture/,2020-08-19,looking at the bigger picture,blog
www.kevinrchant.com,https://www.kevinrchant.com/2020/09/02/tips-about-creating-database-projects-in-azure-data-studio/,2020-09-02,tips about creating database projects in azure data studio,blog
www.kevinrchant.com,https://www.kevinrchant.com/2020/09/10/organize-data-platform-presentations-using-azure-devops/,2020-09-10,organize data platform presentations using azure devops,blog
www.kevinrchant.com,https://www.kevinrchant.com/2020/09/16/update-both-a-sql-server-2019-database-and-an-azure-sql-database-with-one-commit/,2020-09-16,update both a sql server 2019 database and an azure sql database with one commit,blog
www.kevinrchant.com,https://www.kevinrchant.com/2020/09/30/you-can-set-default-branch-name-for-new-repositories-in-azure-devops/,2020-09-30,you can set default branch name for new repositories in azure devops,blog
www.kevinrchant.com,https://www.kevinrchant.com/2020/10/08/what-is-new-for-the-next-dataweekender/,2020-10-11,what is new for the next dataweekender,blog
www.kevinrchant.com,https://www.kevinrchant.com/2020/10/15/dataweekenders-unique-formula/,2020-10-15,dataweekenders unique formula,blog
www.kevinrchant.com,https://www.kevinrchant.com/2020/10/19/initial-thoughts-about-second-dataweekender/,2020-10-20,initial thoughts about second dataweekender,blog
www.kevinrchant.com,https://www.kevinrchant.com/2020/10/21/deploying-to-many-versions-of-sql-server-databases-using-one-commit/,2020-10-21,deploying to many versions of sql server databases using one commit,blog
www.kevinrchant.com,https://www.kevinrchant.com/2020/11/04/sharing-personal-azure-devops-organizations-to-test-sql-server-deployments/,2020-11-04,sharing personal azure devops organizations to test sql server deployments,blog
www.kevinrchant.com,https://www.kevinrchant.com/2020/11/12/sql-server-product-owner-tips-to-make-the-most-of-microsoft-teams/,2020-11-12,sql server product owner tips to make the most of microsoft teams,blog
www.kevinrchant.com,https://www.kevinrchant.com/2020/12/08/t-sql-tuesday-133-learning-new-things-by-building-demos/,2020-12-08,t sql tuesday 133 learning new things by building demos,blog
www.kevinrchant.com,https://www.kevinrchant.com/2019/01/10/patching-sql-server-on-windows-notes-from-the-field/,2020-12-17,patching sql server on windows notes from the field,blog
www.kevinrchant.com,https://www.kevinrchant.com/2021/01/04/an-interesting-month-to-take-off/,2021-01-04,an interesting month to take off,blog
www.kevinrchant.com,https://www.kevinrchant.com/2018/11/28/fixing-some-of-the-problems-caused-when-you-introduce-columnstore-indexes/,2021-01-05,fixing some of the problems caused when you introduce columnstore indexes,blog
www.kevinrchant.com,https://www.kevinrchant.com/2018/11/27/fixing-some-of-the-problems-caused-when-you-introduce-rowstore-filtered-indexes/,2021-01-05,fixing some of the problems caused when you introduce rowstore filtered indexes,blog
www.kevinrchant.com,https://www.kevinrchant.com/2018/10/18/a-unique-review-of-sql-server-index-types/,2021-01-05,a unique review of sql server index types,blog
www.kevinrchant.com,https://www.kevinrchant.com/2018/10/16/a-quick-introduction-to-power-bi-report-server/,2021-01-05,a quick introduction to power bi report server,blog
www.kevinrchant.com,https://www.kevinrchant.com/2018/11/26/a-couple-of-things-to-watch-out-for-if-deploying-power-bi-reporting-services/,2021-01-05,a couple of things to watch out for if deploying power bi reporting services,blog
www.kevinrchant.com,https://www.kevinrchant.com/2018/10/23/how-sql-server-dbas-can-use-power-bi-report-server/,2021-01-05,how sql server dbas can use power bi report server,blog
www.kevinrchant.com,https://www.kevinrchant.com/2018/10/09/my-first-t-sql-tuesday-contribution-death-march/,2021-01-06,my first t sql tuesday contribution death march,blog
www.kevinrchant.com,https://www.kevinrchant.com/2018/11/06/useful-sql-server-related-powershell-modules-for-the-dba/,2021-01-07,useful sql server related powershell modules for the dba,blog
www.kevinrchant.com,https://www.kevinrchant.com/2021/01/07/giving-some-2018-posts-a-makeover/,2021-01-07,giving some 2018 posts a makeover,blog
www.kevinrchant.com,https://www.kevinrchant.com/2021/01/12/t-sql-tuesday-134-taking-breaks/,2021-01-12,t sql tuesday 134 taking breaks,blog
www.kevinrchant.com,https://www.kevinrchant.com/2021/02/01/transform-your-sql-server-database-schema-for-a-dedicated-sql-pool/,2021-02-01,transform your sql server database schema for a dedicated sql pool,blog
www.kevinrchant.com,https://www.kevinrchant.com/2021/04/03/dataweekender-v3-1-call-for-speakers-ends-in-seven-days/,2021-04-03,dataweekender v3 1 call for speakers ends in seven days,blog
www.kevinrchant.com,https://www.kevinrchant.com/2021/04/08/additional-speaker-info-for-dataweekender-v3-1/,2021-04-09,additional speaker info for dataweekender v3 1,blog
www.kevinrchant.com,https://www.kevinrchant.com/2021/03/22/thoughts-about-the-increase-in-demand-for-azure-data-engineering-roles/,2021-05-17,thoughts about the increase in demand for azure data engineering roles,blog
www.kevinrchant.com,https://www.kevinrchant.com/2020/12/21/2020-edition-of-sql-server-related-services-in-azure/,2021-05-25,2020 edition of sql server related services in azure,blog
www.kevinrchant.com,https://www.kevinrchant.com/2020/12/14/deploying-to-multiple-sql-server-database-types-using-azure-devops-faster/,2021-05-25,deploying to multiple sql server database types using azure devops faster,blog
www.kevinrchant.com,https://www.kevinrchant.com/2019/12/25/sql-server-related-services-in-azure-2019/,2021-05-25,sql server related services in azure 2019,blog
www.kevinrchant.com,https://www.kevinrchant.com/2021/03/12/call-for-speakers-for-dataweekender-v3-1-is-now-open/,2021-05-25,call for speakers for dataweekender v3 1 is now open,blog
www.kevinrchant.com,https://www.kevinrchant.com/2021/03/09/t-sql-tuesday-136-bit-versus-other-data-types/,2021-05-25,t sql tuesday 136 bit versus other data types,blog
www.kevinrchant.com,https://www.kevinrchant.com/2021/02/25/date-for-dataweekender-v3-1-has-been-announced/,2021-05-25,date for dataweekender v3 1 has been announced,blog
www.kevinrchant.com,https://www.kevinrchant.com/2020/10/03/schedule-for-next-dataweekender-is-now-live/,2021-05-25,schedule for next dataweekender is now live,blog
www.kevinrchant.com,https://www.kevinrchant.com/2020/08/24/dataweekender-call-for-speakers-is-now-open/,2021-05-25,dataweekender call for speakers is now open,blog
www.kevinrchant.com,https://www.kevinrchant.com/2021/03/25/how-to-make-the-most-out-of-certification-pages-for-azure-exams/,2021-05-31,how to make the most out of certification pages for azure exams,blog
www.kevinrchant.com,https://www.kevinrchant.com/2020/03/02/certification-announcement-by-microsoft-and-the-coronavirus/,2021-05-31,certification announcement by microsoft and the coronavirus,blog
www.kevinrchant.com,https://www.kevinrchant.com/2020/06/15/passing-the-az-400-devops-exam/,2021-05-31,passing the az 400 devops exam,blog
www.kevinrchant.com,https://www.kevinrchant.com/2019/01/17/running-sql-server-within-hyper-v-on-your-own-laptop/,2021-06-16,running sql server within hyper v on your own laptop,blog
www.kevinrchant.com,https://www.kevinrchant.com/2019/05/01/sql-servers-complex-relationship-with-file-permissions/,2021-06-16,sql servers complex relationship with file permissions,blog
www.kevinrchant.com,https://www.kevinrchant.com/2019/07/09/t-sql-tuesday-116-adopting-sql-server-on-linux/,2021-06-16,t sql tuesday 116 adopting sql server on linux,blog
www.kevinrchant.com,https://www.kevinrchant.com/2019/09/03/t-sql-tuesday-118-your-fantasy-sql-feature/,2021-06-16,t sql tuesday 118 your fantasy sql feature,blog
www.kevinrchant.com,https://www.kevinrchant.com/2019/03/28/using-linux-desktop-environment-with-sql-server/,2021-06-16,using linux desktop environment with sql server,blog
www.kevinrchant.com,https://www.kevinrchant.com/2018/11/13/t-sql-tuesday-relearning-linux/,2021-06-16,t sql tuesday relearning linux,blog
www.kevinrchant.com,https://www.kevinrchant.com/2019/05/14/t-sql-tuesday-114-powershell-puzzle/,2021-06-16,t sql tuesday 114 powershell puzzle,blog
www.kevinrchant.com,https://www.kevinrchant.com/2019/03/18/personal-azure-resource-manager-templates-overview/,2021-06-16,personal azure resource manager templates overview,blog
www.kevinrchant.com,https://www.kevinrchant.com/2019/04/09/t-sql-tuesday-113-what-i-use-databases-for/,2021-06-16,t sql tuesday 113 what i use databases for,blog
www.kevinrchant.com,https://www.kevinrchant.com/2018/12/05/various-cloud-infrastructure-options-to-consider-when-choosing-a-cloud-provider/,2021-06-16,various cloud infrastructure options to consider when choosing a cloud provider,blog
www.kevinrchant.com,https://www.kevinrchant.com/2019/03/05/sqlbits-2019/,2021-06-16,sqlbits 2019,blog
www.kevinrchant.com,https://www.kevinrchant.com/2019/02/12/t-sql-tuesday-111-why-i-do-what-i-do/,2021-06-16,t sql tuesday 111 why i do what i do,blog
www.kevinrchant.com,https://www.kevinrchant.com/2019/05/29/creating-clustered-columnstore-indexes-everywhere/,2021-06-16,creating clustered columnstore indexes everywhere,blog
www.kevinrchant.com,https://www.kevinrchant.com/2018/12/04/building-a-test-lab-to-use-outside-work/,2021-06-16,building a test lab to use outside work,blog
www.kevinrchant.com,https://www.kevinrchant.com/2019/07/10/looking-back-at-sql-server-2008-and-sql-server-2008-r2/,2021-06-16,looking back at sql server 2008 and sql server 2008 r2,blog
www.kevinrchant.com,https://www.kevinrchant.com/2019/08/07/linux-distributions-you-can-install-sql-server-on/,2021-06-16,linux distributions you can install sql server on,blog
www.kevinrchant.com,https://www.kevinrchant.com/2019/09/12/t-sql-tuesday-118-roundup/,2021-06-16,t sql tuesday 118 roundup,blog
www.kevinrchant.com,https://www.kevinrchant.com/2019/01/29/starting-to-use-azure-for-the-data-platform-professional/,2021-06-16,starting to use azure for the data platform professional,blog
www.kevinrchant.com,https://www.kevinrchant.com/2019/06/04/sql-server-2019-business-cases/,2021-06-16,sql server 2019 business cases,blog
www.kevinrchant.com,https://www.kevinrchant.com/2019/09/10/t-sql-tuesday-118-automatic-index-management-levels/,2021-06-16,t sql tuesday 118 automatic index management levels,blog
www.kevinrchant.com,https://www.kevinrchant.com/2019/06/11/t-sql-tuesday-115-dear-20-year-old-self/,2021-06-16,t sql tuesday 115 dear 20 year old self,blog
www.kevinrchant.com,https://www.kevinrchant.com/2018/12/31/alternative-data-platform-new-years-post/,2021-06-16,alternative data platform new years post,blog
www.kevinrchant.com,https://www.kevinrchant.com/2018/11/22/my-first-us-sql-saturday-and-pass-summit-visits/,2021-06-16,my first us sql saturday and pass summit visits,blog
www.kevinrchant.com,https://www.kevinrchant.com/2019/03/20/amount-of-powershell-used-to-work-with-sql-server/,2021-06-16,amount of powershell used to work with sql server,blog
www.kevinrchant.com,https://www.kevinrchant.com/2019/10/04/speaking-at-sql-saturday-torun/,2021-06-16,speaking at sql saturday torun,blog
www.kevinrchant.com,https://www.kevinrchant.com/2019/01/31/applications-for-data-platform-professionals-to-install-locally-for-sql-server-in-azure/,2021-06-16,applications for data platform professionals to install locally for sql server in azure,blog
www.kevinrchant.com,https://www.kevinrchant.com/2018/11/01/a-one-stop-post-for-data-platform-one-stop-posts/,2021-06-16,a one stop post for data platform one stop posts,blog
www.kevinrchant.com,https://www.kevinrchant.com/2018/12/06/sql-server-related-services-available-with-top-four-cloud-providers/,2021-06-16,sql server related services available with top four cloud providers,blog
www.kevinrchant.com,https://www.kevinrchant.com/2019/07/17/powershell-modules-on-every-sql-server/,2021-06-16,powershell modules on every sql server,blog
www.kevinrchant.com,https://www.kevinrchant.com/2018/12/10/azure-stack-for-the-sql-server-professional/,2021-06-16,azure stack for the sql server professional,blog
www.kevinrchant.com,https://www.kevinrchant.com/2019/05/20/interesting-sql-server-2019-findings-testing-sp_estimate_data_compression_savings/,2021-06-16,interesting sql server 2019 findings testing sp estimate data compression savings,blog
www.kevinrchant.com,https://www.kevinrchant.com/2019/08/21/fantastic-azure-sql-database-managed-instances-update/,2021-06-16,fantastic azure sql database managed instances update,blog
www.kevinrchant.com,https://www.kevinrchant.com/2019/04/29/upgrading-to-latest-sql-server-2019-ctp-on-linux-using-local-repository/,2021-06-16,upgrading to latest sql server 2019 ctp on linux using local repository,blog
www.kevinrchant.com,https://www.kevinrchant.com/2019/07/03/new-certification-and-sql-saturday-cork/,2021-06-16,new certification and sql saturday cork,blog
www.kevinrchant.com,https://www.kevinrchant.com/2019/02/21/speaking-at-sqlbits/,2021-06-16,speaking at sqlbits,blog
www.kevinrchant.com,https://www.kevinrchant.com/2019/05/27/upgrading-to-sql-server-2019-ctp-3/,2021-06-16,upgrading to sql server 2019 ctp 3,blog
www.kevinrchant.com,https://www.kevinrchant.com/2019/07/29/sql-server-2019-ctp-3-2-now-available/,2021-06-16,sql server 2019 ctp 3 2 now available,blog
www.kevinrchant.com,https://www.kevinrchant.com/2018/10/30/zombie-spids-a-true-sql-server-horror-story/,2021-06-16,zombie spids a true sql server horror story,blog
www.kevinrchant.com,https://www.kevinrchant.com/2018/12/27/list-of-all-posts-published-since-pass-summit/,2021-06-16,list of all posts published since pass summit,blog
www.kevinrchant.com,https://www.kevinrchant.com/2019/08/13/t-sql-tuesday-117-memory-optimized-tables/,2021-06-16,t sql tuesday 117 memory optimized tables,blog
www.kevinrchant.com,https://www.kevinrchant.com/2019/08/19/microsoft-professional-program-retiring-thoughts/,2021-06-17,microsoft professional program retiring thoughts,blog
www.kevinrchant.com,https://www.kevinrchant.com/2019/04/10/using-local-repositories-with-sql-server-on-linux/,2021-06-17,using local repositories with sql server on linux,blog
www.kevinrchant.com,https://www.kevinrchant.com/2019/10/09/database-adventure-at-dataminds-connect/,2021-06-17,database adventure at dataminds connect,blog
www.kevinrchant.com,https://www.kevinrchant.com/2018/12/03/hosting-sql-server-on-vmware/,2021-06-17,hosting sql server on vmware,blog
www.kevinrchant.com,https://www.kevinrchant.com/2019/08/26/sql-server-2019-release-candidate-released/,2021-06-17,sql server 2019 release candidate released,blog
www.kevinrchant.com,https://www.kevinrchant.com/2018/10/25/voting-for-sqlbits-general-sessions-is-now-open/,2021-06-17,voting for sqlbits general sessions is now open,blog
www.kevinrchant.com,https://www.kevinrchant.com/2019/02/06/moving-to-the-netherlands-and-starting-a-new-sql-server-job-there/,2021-06-17,moving to the netherlands and starting a new sql server job there,blog
www.kevinrchant.com,https://www.kevinrchant.com/2021/05/17/dataweekender-v3-1-conference-experience/,2021-06-18,dataweekender v3 1 conference experience,blog
www.kevinrchant.com,https://www.kevinrchant.com/2021/05/05/dp-203-azure-data-engineering-exam-is-now-ga/,2021-06-18,dp 203 azure data engineering exam is now ga,blog
www.kevinrchant.com,https://www.kevinrchant.com/2021/03/29/clear-up-confusion-about-different-versions-of-azure-devops/,2021-06-18,clear up confusion about different versions of azure devops,blog
www.kevinrchant.com,https://www.kevinrchant.com/2019/04/15/sql-server-2019-database-scoped-settings-for-indexes-discovery/,2021-06-18,sql server 2019 database scoped settings for indexes discovery,blog
www.kevinrchant.com,https://www.kevinrchant.com/2019/07/23/personal-sql-server-2019-lab-review/,2021-06-18,personal sql server 2019 lab review,blog
www.kevinrchant.com,https://www.kevinrchant.com/2018/12/17/maintaining-your-larger-databases-better-part-4-recommended-free-tools-for-the-job/,2021-06-20,maintaining your larger databases better part 4 recommended free tools for the job,blog
www.kevinrchant.com,https://www.kevinrchant.com/2018/11/30/maintaining-your-larger-databases-better-part-2-2/,2021-06-20,maintaining your larger databases better part 2 2,blog
www.kevinrchant.com,https://www.kevinrchant.com/2018/11/29/maintaining-your-larger-databases-better-part-1/,2021-06-20,maintaining your larger databases better part 1,blog
www.kevinrchant.com,https://www.kevinrchant.com/2018/12/12/maintaining-your-larger-databases-better-part-3-recommended-sql-server-dmvs/,2021-06-20,maintaining your larger databases better part 3 recommended sql server dmvs,blog
www.kevinrchant.com,https://www.kevinrchant.com/2020/05/18/updates-about-what-linux-distributions-you-can-install-sql-server-on/,2021-06-29,updates about what linux distributions you can install sql server on,blog
www.kevinrchant.com,https://www.kevinrchant.com/2019/11/06/personal-2019-pass-election-vote-for-johan/,2021-06-29,personal 2019 pass election vote for johan,blog
www.kevinrchant.com,https://www.kevinrchant.com/2019/11/04/sql-server-2019-officially-released/,2021-06-29,sql server 2019 officially released,blog
www.kevinrchant.com,https://www.kevinrchant.com/2020/09/23/more-about-sql-server-professionals-using-version-control/,2021-06-29,more about sql server professionals using version control,blog
www.kevinrchant.com,https://www.kevinrchant.com/2020/04/29/azure-related-topics-at-data-community-weekender-europe/,2021-06-29,azure related topics at data community weekender europe,blog
www.kevinrchant.com,https://www.kevinrchant.com/2020/06/17/using-version-control-with-an-azure-data-studio-notebook/,2021-06-29,using version control with an azure data studio notebook,blog
www.kevinrchant.com,https://www.kevinrchant.com/2020/03/23/personal-working-from-home-again-thoughts-and-tips/,2021-06-29,personal working from home again thoughts and tips,blog
www.kevinrchant.com,https://www.kevinrchant.com/2019/04/01/current-sql-server-2019-learning-resources/,2021-06-29,current sql server 2019 learning resources,blog
www.kevinrchant.com,https://www.kevinrchant.com/2019/12/05/maintaining-larger-sql-server-databases-recap/,2021-06-29,maintaining larger sql server databases recap,blog
www.kevinrchant.com,https://www.kevinrchant.com/2020/02/24/tips-for-dealing-with-large-sql-server-scripts/,2021-06-29,tips for dealing with large sql server scripts,blog
www.kevinrchant.com,https://www.kevinrchant.com/2020/01/08/lessons-learned-by-a-time-travelling-sql-server-dba-part-one-the-past/,2021-06-29,lessons learned by a time travelling sql server dba part one the past,blog
www.kevinrchant.com,https://www.kevinrchant.com/2019/01/24/study-tips-for-sql-server-and-azure-exams/,2021-06-29,study tips for sql server and azure exams,blog
www.kevinrchant.com,https://www.kevinrchant.com/2020/07/01/testing-sql-server-assessment-in-azure-data-studio/,2021-06-30,testing sql server assessment in azure data studio,blog
www.kevinrchant.com,https://www.kevinrchant.com/2020/01/15/lessons-learned-by-a-time-travelling-sql-server-dba-part-two-the-future/,2021-06-30,lessons learned by a time travelling sql server dba part two the future,blog
www.kevinrchant.com,https://www.kevinrchant.com/2020/06/24/big-appreciation-for-key-workers/,2021-06-30,big appreciation for key workers,blog
www.kevinrchant.com,https://www.kevinrchant.com/2020/05/25/recent-azure-data-studio-updates/,2021-06-30,recent azure data studio updates,blog
www.kevinrchant.com,https://www.kevinrchant.com/2020/10/13/t-sql-tuesday-131-database-analogies/,2021-06-30,t sql tuesday 131 database analogies,blog
www.kevinrchant.com,https://www.kevinrchant.com/2020/04/06/my-nine-days-that-never-happened/,2021-06-30,my nine days that never happened,blog
