website,loc,lastmod,cured_name,type
pragmaticworks.com,https://pragmaticworks.com/blog/what-are-powerapps-portals,2023-03-28,what are powerapps portals,blog
pragmaticworks.com,https://pragmaticworks.com/courses/copilot-in-microsoft-word,2024-11-18,copilot in microsoft word,blog
pragmaticworks.com,https://pragmaticworks.com/events/sep-24-learn-with-the-nerds-power-apps-hackathon-for-charity-172,2024-08-08,sep 24 learn with the nerds power apps hackathon for charity 172,blog
pragmaticworks.com,https://pragmaticworks.com/blog/sql-server-2016-data-masking-and-always-encrypted,2023-03-28,sql server 2016 data masking and always encrypted,blog
pragmaticworks.com,https://pragmaticworks.com/guides/dax-guide/aggregate-functions/dax-guide-max/approximatedistinctcount,2025-03-06,approximatedistinctcount,blog
pragmaticworks.com,https://pragmaticworks.com/blog/plan-your-training-budget-for-2019,2023-03-28,plan your training budget for 2019,blog
pragmaticworks.com,https://pragmaticworks.com/courses/introduction-to-azure-data-factory,2024-11-18,introduction to azure data factory,blog
pragmaticworks.com,https://pragmaticworks.com/courses/introduction-to-mdx,2024-11-18,introduction to mdx,blog
pragmaticworks.com,https://pragmaticworks.com/courses/transforming-data-with-sql-pivots,2024-11-18,transforming data with sql pivots,blog
pragmaticworks.com,https://pragmaticworks.com/blog/3-things-to-know-about-azure-data-warehouse-gen-2,2023-03-28,3 things to know about azure data warehouse gen 2,blog
pragmaticworks.com,https://pragmaticworks.com/blog/integrating-microsoft-translation-services-into-power-apps,2023-03-28,integrating microsoft translation services into power apps,blog
pragmaticworks.com,https://pragmaticworks.com/power-apps,2024-12-18,power apps,blog
pragmaticworks.com,https://pragmaticworks.com/blog/the-database-world-of-azure,2023-03-28,the database world of azure,blog
pragmaticworks.com,https://pragmaticworks.com/sql-server-performance-tuning,2023-08-29,sql server performance tuning,blog
pragmaticworks.com,https://pragmaticworks.com/events/dec-11-virtual-dax-bootcamp-29,2024-03-14,dec 11 virtual dax bootcamp 29,blog
pragmaticworks.com,https://pragmaticworks.com/blog/why-amazon-cant-touch-microsoft-in-the-cloud,2023-03-28,why amazon cant touch microsoft in the cloud,blog
pragmaticworks.com,https://pragmaticworks.com/blog/a-tutorial-of-azure-data-studio,2023-03-28,a tutorial of azure data studio,blog
pragmaticworks.com,https://pragmaticworks.com/blog/incorporate-information-from-survey-monkey-using-rest-source,2024-01-29,incorporate information from survey monkey using rest source,blog
pragmaticworks.com,https://pragmaticworks.com/blog/building-a-predictive-model-with-r-in-sql-server-machine-learning-services,2023-03-28,building a predictive model with r in sql server machine learning services,blog
pragmaticworks.com,https://pragmaticworks.com/blog/top-3-cio-data-concerns,2023-03-28,top 3 cio data concerns,blog
pragmaticworks.com,https://pragmaticworks.com/courses/microsoft-teams-for-the-consumer,2024-11-18,microsoft teams for the consumer,blog
pragmaticworks.com,https://pragmaticworks.com/lwtn-power-automate-beginner-to-pro-registration,2024-05-02,lwtn power automate beginner to pro registration,blog
pragmaticworks.com,https://pragmaticworks.com/blog/using-a-sharepoint-list-in-powerapps,2024-04-23,using a sharepoint list in powerapps,blog
pragmaticworks.com,https://pragmaticworks.com/blog/outperform-the-competition-with-azure-sql-data-warehouse,2023-03-28,outperform the competition with azure sql data warehouse,blog
pragmaticworks.com,https://pragmaticworks.com/blog/our-staffing-provides-post-placement-support,2023-03-28,our staffing provides post placement support,blog
pragmaticworks.com,https://pragmaticworks.com/courses/paginated-reports-in-a-day,2024-11-18,paginated reports in a day,blog
pragmaticworks.com,https://pragmaticworks.com/blog/how-to-add-a-signature-line-to-power-apps,2023-03-28,how to add a signature line to power apps,blog
pragmaticworks.com,https://pragmaticworks.com/introduction-to-power-bi,2023-08-29,introduction to power bi,blog
pragmaticworks.com,https://pragmaticworks.com/blog/azure-know-your-limits,2023-03-28,azure know your limits,blog
pragmaticworks.com,https://pragmaticworks.com/blog/how-to-build-a-tabular-model,2023-03-28,how to build a tabular model,blog
pragmaticworks.com,https://pragmaticworks.com/blog/power-bi-custom-visuals-scroller,2023-03-28,power bi custom visuals scroller,blog
pragmaticworks.com,https://pragmaticworks.com/blog/power-bi-monthly-digest-september-2019,2023-03-28,power bi monthly digest september 2019,blog
pragmaticworks.com,https://pragmaticworks.com/guides/dax-guide/aggregate-functions/dax-guide-min/maxa,2025-03-06,maxa,blog
pragmaticworks.com,https://pragmaticworks.com/blog/what-is-azure-active-directory-seamless-single-sign-on,2023-03-28,what is azure active directory seamless single sign on,blog
pragmaticworks.com,https://pragmaticworks.com/blog/how-are-iot-hub-event-hub-and-event-grid-related,2023-03-28,how are iot hub event hub and event grid related,blog
pragmaticworks.com,https://pragmaticworks.com/instructors/brian-knight,2024-04-28,brian knight,blog
pragmaticworks.com,https://pragmaticworks.com/blog/how-do-azure-accounts-and-subscriptions-work-together,2023-03-28,how do azure accounts and subscriptions work together,blog
pragmaticworks.com,https://pragmaticworks.com/events/nov-06-virtual-t-sql-boot-camp-35,2024-03-14,nov 06 virtual t sql boot camp 35,blog
pragmaticworks.com,https://pragmaticworks.com/interactive-dashboards-with-excel,2023-08-29,interactive dashboards with excel,blog
pragmaticworks.com,https://pragmaticworks.com/courses/visual-calculations-for-dax-in-power-bi,2024-11-18,visual calculations for dax in power bi,blog
pragmaticworks.com,https://pragmaticworks.com/blog/premium-capacity-without-power-bi-premium,2023-03-28,premium capacity without power bi premium,blog
pragmaticworks.com,https://pragmaticworks.com/blog/utilizing-microsoft-stream,2023-03-28,utilizing microsoft stream,blog
pragmaticworks.com,https://pragmaticworks.com/courses/dax-guides-aggregations,2024-11-21,dax guides aggregations,blog
pragmaticworks.com,https://pragmaticworks.com/courses/power-apps-problem-design-solution,2024-11-18,power apps problem design solution,blog
pragmaticworks.com,https://pragmaticworks.com/blog/using-kpi-visuals-in-power-bi,2024-03-08,using kpi visuals in power bi,blog
pragmaticworks.com,https://pragmaticworks.com/blog/building-a-scalable-application-with-azure-functions,2023-03-28,building a scalable application with azure functions,blog
pragmaticworks.com,https://pragmaticworks.com/sql-server-high-availability,2023-08-29,sql server high availability,blog
pragmaticworks.com,https://pragmaticworks.com/blog/introduction-to-pyspark-in-microsoft-fabric,2024-03-25,introduction to pyspark in microsoft fabric,blog
pragmaticworks.com,https://pragmaticworks.com/about-us/faqs,2024-02-21,faqs,blog
pragmaticworks.com,https://pragmaticworks.com/blog/how-to-create-a-simple-approval-flow-with-microsoft-flow,2023-03-28,how to create a simple approval flow with microsoft flow,blog
pragmaticworks.com,https://pragmaticworks.com/courses/learn-with-the-nerds-end-to-end-solution-to-learn-power-apps-and-dataverse,2024-11-18,learn with the nerds end to end solution to learn power apps and dataverse,blog
pragmaticworks.com,https://pragmaticworks.com/events/sep-17-virtual-advanced-data-shaping-136,2024-04-18,sep 17 virtual advanced data shaping 136,blog
pragmaticworks.com,https://pragmaticworks.com/blog/a-beginners-guide-to-dataflows-in-power-bi,2023-03-28,a beginners guide to dataflows in power bi,blog
pragmaticworks.com,https://pragmaticworks.com/blog/webinar-follow-up-getting-started-with-change-data-capture,2024-10-01,webinar follow up getting started with change data capture,blog
pragmaticworks.com,https://pragmaticworks.com/blog/setting-up-power-bi-team-project-collaboration-and-version-control,2023-03-28,setting up power bi team project collaboration and version control,blog
pragmaticworks.com,https://pragmaticworks.com/blog/power-bi-custom-visuals-a-comprehensive-guide,2023-09-20,power bi custom visuals a comprehensive guide,blog
pragmaticworks.com,https://pragmaticworks.com/events/nov-18-virtual-advanced-power-bi-bootcamp-153,2024-07-12,nov 18 virtual advanced power bi bootcamp 153,blog
pragmaticworks.com,https://pragmaticworks.com/blog/replicate-data-into-azure-database-for-mysql,2023-03-28,replicate data into azure database for mysql,blog
pragmaticworks.com,https://pragmaticworks.com/blog/using-entities-in-copilot-studio-for-teams-power-platform-for-educators-ep.-8,2025-01-13,using entities in copilot studio for teams power platform for educators ep. 8,blog
pragmaticworks.com,https://pragmaticworks.com/lwtn-power-pages-beginner-to-pro-event,2024-12-06,lwtn power pages beginner to pro event,blog
pragmaticworks.com,https://pragmaticworks.com/blog/migrating-power-bi-reports-to-microsoft-fabric-data-flow-gen-2,2024-02-21,migrating power bi reports to microsoft fabric data flow gen 2,blog
pragmaticworks.com,https://pragmaticworks.com/blog/data-quality-with-azure-data-factory-better-analytics-at-scale,2023-03-28,data quality with azure data factory better analytics at scale,blog
pragmaticworks.com,https://pragmaticworks.com/blog/how-to-control-costs-and-chargebacks-in-azure,2023-03-28,how to control costs and chargebacks in azure,blog
pragmaticworks.com,https://pragmaticworks.com/blog/power-bi-data-challenge-%F0%9F%93%8A-report-from-start-to-finish-%EF%B8%8F,2024-09-28,power bi data challenge  report from start to finish ,blog
pragmaticworks.com,https://pragmaticworks.com/events/mar-24-virtual-power-pages-bootcamp-197,2024-11-01,mar 24 virtual power pages bootcamp 197,blog
pragmaticworks.com,https://pragmaticworks.com/blog/azure-storage-options,2024-05-28,azure storage options,blog
pragmaticworks.com,https://pragmaticworks.com/lwtn-power-apps-beginner-to-pro-registration,2024-04-27,lwtn power apps beginner to pro registration,blog
pragmaticworks.com,https://pragmaticworks.com/blog/power-apps-licensing-guide,2023-03-28,power apps licensing guide,blog
pragmaticworks.com,https://pragmaticworks.com/events/jul-21-virtual-advanced-power-bi-bootcamp-259,2025-03-04,jul 21 virtual advanced power bi bootcamp 259,blog
pragmaticworks.com,https://pragmaticworks.com/blog/take-me-out-to-the-ball-game,2024-02-27,take me out to the ball game,blog
pragmaticworks.com,https://pragmaticworks.com/copilot-in-microsoft-onenote,2024-03-21,copilot in microsoft onenote,blog
pragmaticworks.com,https://pragmaticworks.com/blog/streamlining-power-platform-deployments-with-pipelines,2023-10-20,streamlining power platform deployments with pipelines,blog
pragmaticworks.com,https://pragmaticworks.com/pipelines-and-data-flows-in-azure-synapse-analytics,2023-08-29,pipelines and data flows in azure synapse analytics,blog
pragmaticworks.com,https://pragmaticworks.com/model-driven-apps-in-dataverse-event,2025-02-12,model driven apps in dataverse event,blog
pragmaticworks.com,https://pragmaticworks.com/events/apr-08-virtual-copilot-for-microsoft-365-bootcamp-242,2025-01-29,apr 08 virtual copilot for microsoft 365 bootcamp 242,blog
pragmaticworks.com,https://pragmaticworks.com/blog/power-bi-for-the-consumer,2024-08-05,power bi for the consumer,blog
pragmaticworks.com,https://pragmaticworks.com/courses/azure-devops-for-users,2024-11-18,azure devops for users,blog
pragmaticworks.com,https://pragmaticworks.com/events/mar-08-learn-with-the-nerds-microsoft-project-beginner-to-pro-111,2024-03-14,mar 08 learn with the nerds microsoft project beginner to pro 111,blog
pragmaticworks.com,https://pragmaticworks.com/blog/advanced-pivot-table-enhancements-in-excel,2024-02-03,advanced pivot table enhancements in excel,blog
pragmaticworks.com,https://pragmaticworks.com/blog/power-bi-custom-visuals-horizontal-funnel,2023-03-28,power bi custom visuals horizontal funnel,blog
pragmaticworks.com,https://pragmaticworks.com/guides-old/max-dax-function,2025-02-11,max dax function,blog
pragmaticworks.com,https://pragmaticworks.com/events/jul-17-virtual-microsoft-365-excel-bootcamp-254,2025-02-28,jul 17 virtual microsoft 365 excel bootcamp 254,blog
pragmaticworks.com,https://pragmaticworks.com/blog/relating-related-tables-to-baseball-because-i-miss-sports,2023-03-28,relating related tables to baseball because i miss sports,blog
pragmaticworks.com,https://pragmaticworks.com/power-bi-data-viz-tips-tricks-thank-you,2024-06-24,power bi data viz tips tricks thank you,blog
pragmaticworks.com,https://pragmaticworks.com/blog/should-you-use-logic-apps-or-microsoft-flow-for-automation,2023-03-28,should you use logic apps or microsoft flow for automation,blog
pragmaticworks.com,https://pragmaticworks.com/blog/keys-to-successfully-deploying-power-bi-in-your-enterprise,2024-10-01,keys to successfully deploying power bi in your enterprise,blog
pragmaticworks.com,https://pragmaticworks.com/blog/we-can-stop-bad-data-but-not-bad-golfers,2024-09-03,we can stop bad data but not bad golfers,blog
pragmaticworks.com,https://pragmaticworks.com/courses/advanced-microsoft-teams,2024-11-18,advanced microsoft teams,blog
pragmaticworks.com,https://pragmaticworks.com/guides/dax-guide/aggregate-functions/dax-guide-sum/distinctcountnoblank,2025-03-06,distinctcountnoblank,blog
pragmaticworks.com,https://pragmaticworks.com/events/dec-04-virtual-microsoft-project-bootcamp-40,2024-03-14,dec 04 virtual microsoft project bootcamp 40,blog
pragmaticworks.com,https://pragmaticworks.com/blog/power-bi-monthly-digest-may-2020,2023-03-28,power bi monthly digest may 2020,blog
pragmaticworks.com,https://pragmaticworks.com/guides/dax-guide/aggregate-functions/dax-guide-average1-3/countax,2025-03-06,countax,blog
pragmaticworks.com,https://pragmaticworks.com/courses/copilot-studio-in-a-day,2024-11-18,copilot studio in a day,blog
pragmaticworks.com,https://pragmaticworks.com/blog/nh-sales-team-beach-party,2024-07-09,nh sales team beach party,blog
pragmaticworks.com,https://pragmaticworks.com/about-us/foundation,2024-01-20,foundation,blog
pragmaticworks.com,https://pragmaticworks.com/blog/power-bi-monthly-digest-october-2020,2023-03-28,power bi monthly digest october 2020,blog
pragmaticworks.com,https://pragmaticworks.com/blog/power-bi-custom-visuals-beyondsoft-calendar,2023-03-28,power bi custom visuals beyondsoft calendar,blog
pragmaticworks.com,https://pragmaticworks.com/blog/what-is-application-insights,2023-03-28,what is application insights,blog
pragmaticworks.com,https://pragmaticworks.com/pl-300-microsoft-power-bi-data-analyst,2023-08-29,pl 300 microsoft power bi data analyst,blog
pragmaticworks.com,https://pragmaticworks.com/lwtn-excel-beginner-to-pro-registration,2024-01-08,lwtn excel beginner to pro registration,blog
pragmaticworks.com,https://pragmaticworks.com/events/jun-10-virtual-power-bi-bootcamp-108,2024-03-14,jun 10 virtual power bi bootcamp 108,blog
pragmaticworks.com,https://pragmaticworks.com/blog/incomplete-needs-embed-creating-your-own-secure-sample-database-azure-sql-db,2024-11-08,incomplete needs embed creating your own secure sample database azure sql db,blog
pragmaticworks.com,https://pragmaticworks.com/events/jul-16-virtual-microsoft-365-powerpoint-word-bootcamp-253,2025-02-28,jul 16 virtual microsoft 365 powerpoint word bootcamp 253,blog
pragmaticworks.com,https://pragmaticworks.com/blog/the-1-rule-for-using-powerapps-with-sql-server,2023-03-28,the 1 rule for using powerapps with sql server,blog
pragmaticworks.com,https://pragmaticworks.com/courses/introduction-to-power-bi-datamarts,2024-11-18,introduction to power bi datamarts,blog
pragmaticworks.com,https://pragmaticworks.com/courses/introduction-to-azure-key-vault,2024-11-18,introduction to azure key vault,blog
pragmaticworks.com,https://pragmaticworks.com/blog/power-bi-custom-visuals-text-wrapper-maq-software,2023-03-28,power bi custom visuals text wrapper maq software,blog
pragmaticworks.com,https://pragmaticworks.com/blog/azure-every-day-during-our-azure-data-week-conference,2023-03-28,azure every day during our azure data week conference,blog
pragmaticworks.com,https://pragmaticworks.com/blog/im-speaking-at-sqlsaturday-phoenix,2024-06-07,im speaking at sqlsaturday phoenix,blog
pragmaticworks.com,https://pragmaticworks.com/blog/lets-build-a-power-app-session-4,2023-03-28,lets build a power app session 4,blog
pragmaticworks.com,https://pragmaticworks.com/guides/dax-guide/aggregate-functions/dax-guide-min/minx,2025-03-06,minx,blog
pragmaticworks.com,https://pragmaticworks.com/blog/intro-to-azure-database-for-mysql,2023-03-28,intro to azure database for mysql,blog
pragmaticworks.com,https://pragmaticworks.com/courses/building-solutions-in-dataverse,2024-11-18,building solutions in dataverse,blog
pragmaticworks.com,https://pragmaticworks.com/blog/the-difference-between-elastic-pools-and-elastic-queries,2023-03-28,the difference between elastic pools and elastic queries,blog
pragmaticworks.com,https://pragmaticworks.com/copilot-in-microsoft-whiteboard,2024-04-11,copilot in microsoft whiteboard,blog
pragmaticworks.com,https://pragmaticworks.com/courses/introduction-to-javascript,2024-11-18,introduction to javascript,blog
pragmaticworks.com,https://pragmaticworks.com/introduction-to-power-automate,2024-07-09,introduction to power automate,blog
pragmaticworks.com,https://pragmaticworks.com/events/may-05-virtual-power-bi-pl-300-bootcamp-225,2024-12-23,may 05 virtual power bi pl 300 bootcamp 225,blog
pragmaticworks.com,https://pragmaticworks.com/blog/data-validation-in-dynamics-365-and-power-apps,2023-10-17,data validation in dynamics 365 and power apps,blog
pragmaticworks.com,https://pragmaticworks.com/blog/choosing-the-right-data-source-for-your-power-apps-a-comprehensive-guide,2023-10-17,choosing the right data source for your power apps a comprehensive guide,blog
pragmaticworks.com,https://pragmaticworks.com/blog/go-green-with-blue-using-azure,2023-09-28,go green with blue using azure,blog
pragmaticworks.com,https://pragmaticworks.com/courses/power-platform-for-educators,2024-11-18,power platform for educators,blog
pragmaticworks.com,https://pragmaticworks.com/courses/learn-with-the-nerds-rpa-with-power-automate-desktop-recorded-live-event,2024-11-18,learn with the nerds rpa with power automate desktop recorded live event,blog
pragmaticworks.com,https://pragmaticworks.com/events/may-15-virtual-advanced-dax-measures-102,2024-03-14,may 15 virtual advanced dax measures 102,blog
pragmaticworks.com,https://pragmaticworks.com/blog/rethink-how-you-approach-staff-augmentation,2023-03-28,rethink how you approach staff augmentation,blog
pragmaticworks.com,https://pragmaticworks.com/events/apr-15-virtual-dax-bootcamp-87,2024-03-14,apr 15 virtual dax bootcamp 87,blog
pragmaticworks.com,https://pragmaticworks.com/thank-you-data-modeling-for-power-bi-2024-edition,2024-10-18,thank you data modeling for power bi 2024 edition,blog
pragmaticworks.com,https://pragmaticworks.com/courses/power-bi-report-server-administration,2024-11-18,power bi report server administration,blog
pragmaticworks.com,https://pragmaticworks.com/app-in-a-snap-park-inspection,2023-08-07,app in a snap park inspection,blog
pragmaticworks.com,https://pragmaticworks.com/courses/learn-with-the-nerds-power-bi-dataflows-recorded-live-event,2024-11-18,learn with the nerds power bi dataflows recorded live event,blog
pragmaticworks.com,https://pragmaticworks.com/blog/3-things-to-know-about-azure-managed-instances,2023-03-28,3 things to know about azure managed instances,blog
pragmaticworks.com,https://pragmaticworks.com/guides/dax-guide/aggregate-functions/dax-guide-max,2025-03-06,dax guide max,blog
pragmaticworks.com,https://pragmaticworks.com/blog/how-to-get-started-with-machine-learning-on-azure,2023-03-28,how to get started with machine learning on azure,blog
pragmaticworks.com,https://pragmaticworks.com/blog/performance-tuning-ssas-best-practices,2025-01-21,performance tuning ssas best practices,blog
pragmaticworks.com,https://pragmaticworks.com/courses/app-in-a-snap-project-proposal-and-purchase-approval-app,2024-11-18,app in a snap project proposal and purchase approval app,blog
pragmaticworks.com,https://pragmaticworks.com/blog/university-of-new-haven-transforms-their-reports-with-power-bi,2024-05-21,university of new haven transforms their reports with power bi,blog
pragmaticworks.com,https://pragmaticworks.com/events/sep-17-copilot-for-microsoft-365-bootcamp-166,2024-07-17,sep 17 copilot for microsoft 365 bootcamp 166,blog
pragmaticworks.com,https://pragmaticworks.com/art-and-science-of-excel-modeling,2023-08-07,art and science of excel modeling,blog
pragmaticworks.com,https://pragmaticworks.com/blog/power-bi-monthly-digest-august2021,2023-03-16,power bi monthly digest august2021,blog
pragmaticworks.com,https://pragmaticworks.com/blog/power-automate-send-instant-emails-from-canvasapps,2023-03-16,power automate send instant emails from canvasapps,blog
pragmaticworks.com,https://pragmaticworks.com/courses/app-in-a-day,2024-11-18,app in a day,blog
pragmaticworks.com,https://pragmaticworks.com/blog/microsoft-365-chat-and-copilot-integration,2024-02-01,microsoft 365 chat and copilot integration,blog
pragmaticworks.com,https://pragmaticworks.com/blog/the-secret-to-great-presentations-free-tool-zoomit,2024-10-08,the secret to great presentations free tool zoomit,blog
pragmaticworks.com,https://pragmaticworks.com/events/feb-04-virtual-copilot-for-microsoft-365-bootcamp-185,2024-08-26,feb 04 virtual copilot for microsoft 365 bootcamp 185,blog
pragmaticworks.com,https://pragmaticworks.com/blog/power-bi-custom-visuals-advance-card,2023-03-28,power bi custom visuals advance card,blog
pragmaticworks.com,https://pragmaticworks.com/blog/grouping-and-binning-in-power-bi,2024-01-16,grouping and binning in power bi,blog
pragmaticworks.com,https://pragmaticworks.com/learn-with-the-nerds-creating-a-microsoft-fabric-end-to-end-solution,2023-09-14,learn with the nerds creating a microsoft fabric end to end solution,blog
pragmaticworks.com,https://pragmaticworks.com/blog/power-bi-field-parameters-and-measure-slicers,2023-12-07,power bi field parameters and measure slicers,blog
pragmaticworks.com,https://pragmaticworks.com/blog/getting-started-using-azure-ml,2023-03-28,getting started using azure ml,blog
pragmaticworks.com,https://pragmaticworks.com/blog/find-your-identity-in-azure-with-iam,2023-03-28,find your identity in azure with iam,blog
pragmaticworks.com,https://pragmaticworks.com/learn-with-the-nerds-understanding-dax-concepts-with-power-bi-recorded-live-event,2023-08-29,learn with the nerds understanding dax concepts with power bi recorded live event,blog
pragmaticworks.com,https://pragmaticworks.com/blog/power-bi-problem-design-solution-concatenated-tooltip,2023-03-28,power bi problem design solution concatenated tooltip,blog
pragmaticworks.com,https://pragmaticworks.com/blog/are-professional-certifications-a-scam-or-are-they-worth-it,2024-10-10,are professional certifications a scam or are they worth it,blog
pragmaticworks.com,https://pragmaticworks.com/blog/pragmatic-works-sees-growth-using-data-lifecycle-optimization,2023-03-16,pragmatic works sees growth using data lifecycle optimization,blog
pragmaticworks.com,https://pragmaticworks.com/courses/learn-with-the-nerds-power-bi-administration-recorded-live-event,2024-11-18,learn with the nerds power bi administration recorded live event,blog
pragmaticworks.com,https://pragmaticworks.com/blog/power-bi-custom-visuals-mapbox-visual,2023-03-28,power bi custom visuals mapbox visual,blog
pragmaticworks.com,https://pragmaticworks.com/blog/power-bi-lasso-select,2024-06-17,power bi lasso select,blog
pragmaticworks.com,https://pragmaticworks.com/blog/announcing-our-new-course-introduction-to-power-apps,2023-03-28,announcing our new course introduction to power apps,blog
pragmaticworks.com,https://pragmaticworks.com/blog/table-partitioning-in-sql-server-the-basics,2024-02-13,table partitioning in sql server the basics,blog
pragmaticworks.com,https://pragmaticworks.com/events/aug-14-virtual-power-platform-bootcamp-17,2024-03-14,aug 14 virtual power platform bootcamp 17,blog
pragmaticworks.com,https://pragmaticworks.com/downloads,2025-01-20,downloads,blog
pragmaticworks.com,https://pragmaticworks.com/blog/power-bi-monthly-digest-july-2019,2023-03-28,power bi monthly digest july 2019,blog
pragmaticworks.com,https://pragmaticworks.com/blog/power-bi-custom-visuals-tachometer,2023-03-28,power bi custom visuals tachometer,blog
pragmaticworks.com,https://pragmaticworks.com/guides/dax-guide/aggregate-functions/dax-guide-sum/mina,2025-03-06,mina,blog
pragmaticworks.com,https://pragmaticworks.com/blog/creating-a-simple-report-with-power-query-and-power-view,2024-05-21,creating a simple report with power query and power view,blog
pragmaticworks.com,https://pragmaticworks.com/blog/the-new-outlook-activity-in-azure-data-factory-pipelines,2024-01-03,the new outlook activity in azure data factory pipelines,blog
pragmaticworks.com,https://pragmaticworks.com/events/jul-25-virtual-power-bi-administration-264,2025-03-04,jul 25 virtual power bi administration 264,blog
pragmaticworks.com,https://pragmaticworks.com/blog/sql-server-2016-polybase-setup,2025-02-11,sql server 2016 polybase setup,blog
pragmaticworks.com,https://pragmaticworks.com/copilot-studio,2025-03-18,copilot studio,blog
pragmaticworks.com,https://pragmaticworks.com/blog/securing-your-azure-environment-in-under-5-minutes,2023-03-28,securing your azure environment in under 5 minutes,blog
pragmaticworks.com,https://pragmaticworks.com/blog/using-power-bi-for-digital-storytelling,2023-03-28,using power bi for digital storytelling,blog
pragmaticworks.com,https://pragmaticworks.com/courses/dba-fundamentals,2024-11-18,dba fundamentals,blog
