website,loc,lastmod,cured_name,type
pragmaticworks.com,https://pragmaticworks.com/courses/power-bi-calculation-groups,2024-11-18,power bi calculation groups,blog
pragmaticworks.com,https://pragmaticworks.com/blog/5-components-of-a-data-strategy,2023-03-28,5 components of a data strategy,blog
pragmaticworks.com,https://pragmaticworks.com/courses/unlock-creativity-with-microsoft-designer,2024-11-18,unlock creativity with microsoft designer,blog
pragmaticworks.com,https://pragmaticworks.com/events/feb-10-virtual-power-bi-bootcamp-187,2024-08-26,feb 10 virtual power bi bootcamp 187,blog
pragmaticworks.com,https://pragmaticworks.com/guides/dax-guide/aggregate-functions/dax-guide-sum/productx,2025-03-06,productx,blog
pragmaticworks.com,https://pragmaticworks.com/blog/transforming-into-a-cloud-business,2023-03-28,transforming into a cloud business,blog
pragmaticworks.com,https://pragmaticworks.com/courses/interactive-dashboards-with-excel,2024-11-18,interactive dashboards with excel,blog
pragmaticworks.com,https://pragmaticworks.com/guides/dax-guide/aggregate-functions/dax-guide-sum/counta,2025-03-06,counta,blog
pragmaticworks.com,https://pragmaticworks.com/blog/azure-databricks-easy-and-fast,2023-03-28,azure databricks easy and fast,blog
pragmaticworks.com,https://pragmaticworks.com/advanced-azure-data-factory,2024-07-09,advanced azure data factory,blog
pragmaticworks.com,https://pragmaticworks.com/blog/power-bi-custom-visuals-heatmap,2023-03-28,power bi custom visuals heatmap,blog
pragmaticworks.com,https://pragmaticworks.com/blog/can-azure-data-factory-read-excel-files-from-data-lake,2023-03-28,can azure data factory read excel files from data lake,blog
pragmaticworks.com,https://pragmaticworks.com/blog/what-is-microsoft-graph,2023-03-28,what is microsoft graph,blog
pragmaticworks.com,https://pragmaticworks.com/blog/learn-powerapps-for-free-with-our-app-in-a-day-course,2025-01-06,learn powerapps for free with our app in a day course,blog
pragmaticworks.com,https://pragmaticworks.com/blog/how-to-get-your-developers-using-azure,2023-03-28,how to get your developers using azure,blog
pragmaticworks.com,https://pragmaticworks.com/events/sep-19-virtual-advanced-data-visualizations-138,2024-04-18,sep 19 virtual advanced data visualizations 138,blog
pragmaticworks.com,https://pragmaticworks.com/events/may-05-virtual-python-for-data-analyst-bootcamp-220,2024-12-20,may 05 virtual python for data analyst bootcamp 220,blog
pragmaticworks.com,https://pragmaticworks.com/events/apr-07-virtual-microsoft-copilot-bootcamp-240,2025-01-29,apr 07 virtual microsoft copilot bootcamp 240,blog
pragmaticworks.com,https://pragmaticworks.com/guides/dax-guide/aggregate-functions/dax-guide-sum/countax,2025-03-06,countax,blog
pragmaticworks.com,https://pragmaticworks.com/courses/introduction-to-ssis,2024-11-18,introduction to ssis,blog
pragmaticworks.com,https://pragmaticworks.com/learn-with-the-nerds-beginner-to-t-sql-recorded-live-event,2023-08-29,learn with the nerds beginner to t sql recorded live event,blog
pragmaticworks.com,https://pragmaticworks.com/blog/power-bi-custom-visuals-hierarchy-slicer,2023-03-28,power bi custom visuals hierarchy slicer,blog
pragmaticworks.com,https://pragmaticworks.com/power-platform-conference-2024,2024-08-20,power platform conference 2024,blog
pragmaticworks.com,https://pragmaticworks.com/guides/dax-guide/aggregate-functions/dax-guide-min/averagex,2025-03-06,averagex,blog
pragmaticworks.com,https://pragmaticworks.com/courses/advanced-ssas,2024-11-18,advanced ssas,blog
pragmaticworks.com,https://pragmaticworks.com/blog/paginated-reports-in-power-bi,2023-03-28,paginated reports in power bi,blog
pragmaticworks.com,https://pragmaticworks.com/blog/power-bi-custom-visuals-chord,2023-03-28,power bi custom visuals chord,blog
pragmaticworks.com,https://pragmaticworks.com/guides-old/maxx-dax-function,2025-02-11,maxx dax function,blog
pragmaticworks.com,https://pragmaticworks.com/power-platform-conference,2023-09-26,power platform conference,blog
pragmaticworks.com,https://pragmaticworks.com/blog/whats-new-on-the-pl-300-power-bi-certification-exam,2025-02-04,whats new on the pl 300 power bi certification exam,blog
pragmaticworks.com,https://pragmaticworks.com/blog/all-about-sql-server-2016,2023-03-28,all about sql server 2016,blog
pragmaticworks.com,https://pragmaticworks.com/events/sep-19-copilot-studio-bootcamp-167,2024-07-17,sep 19 copilot studio bootcamp 167,blog
pragmaticworks.com,https://pragmaticworks.com/schedule/in-a-day-workshops,2025-03-19,in a day workshops,blog
pragmaticworks.com,https://pragmaticworks.com/blog/power-bi-custom-visuals-percentile-chart,2023-03-28,power bi custom visuals percentile chart,blog
pragmaticworks.com,https://pragmaticworks.com/blog/save-multiple-attachments-and-files-from-microsoft-forms-to-a-sharepoint-list-with-power-automate,2024-09-13,save multiple attachments and files from microsoft forms to a sharepoint list with power automate,blog
pragmaticworks.com,https://pragmaticworks.com/blog/creating-tables-in-microsoft-fabric-warehouses,2023-10-18,creating tables in microsoft fabric warehouses,blog
pragmaticworks.com,https://pragmaticworks.com/blog/slice-or-bookmark-in-power-bi,2023-03-28,slice or bookmark in power bi,blog
pragmaticworks.com,https://pragmaticworks.com/blog/power-bi-custom-visuals-drilldown-player,2023-03-28,power bi custom visuals drilldown player,blog
pragmaticworks.com,https://pragmaticworks.com/courses/unity-catalog-for-databricks,2024-12-19,unity catalog for databricks,blog
pragmaticworks.com,https://pragmaticworks.com,2025-03-20,,blog
pragmaticworks.com,https://pragmaticworks.com/blog/using-azure-devops-for-project-management,2023-03-28,using azure devops for project management,blog
pragmaticworks.com,https://pragmaticworks.com/power-bi-for-the-consumer,2023-10-03,power bi for the consumer,blog
pragmaticworks.com,https://pragmaticworks.com/courses/creating-components-for-canvas-applications,2024-11-18,creating components for canvas applications,blog
pragmaticworks.com,https://pragmaticworks.com/power-apps-in-edu-webinar-registration,2024-09-20,power apps in edu webinar registration,blog
pragmaticworks.com,https://pragmaticworks.com/courses/portfolio-builder-presidential-elections-data,2025-01-24,portfolio builder presidential elections data,blog
pragmaticworks.com,https://pragmaticworks.com/blog/data-migration-assistant-azure-sql-database,2023-03-28,data migration assistant azure sql database,blog
pragmaticworks.com,https://pragmaticworks.com/blog/powerapps-sum-function-and-collections,2023-03-16,powerapps sum function and collections,blog
pragmaticworks.com,https://pragmaticworks.com/lwtn-data-engineering-in-microsoft-fabric-registration,2024-05-07,lwtn data engineering in microsoft fabric registration,blog
pragmaticworks.com,https://pragmaticworks.com/courses/copilot-in-power-bi,2024-11-18,copilot in power bi,blog
pragmaticworks.com,https://pragmaticworks.com/blog/power-apps-if...then-statements-using-sharepoint,2023-03-28,power apps if...then statements using sharepoint,blog
pragmaticworks.com,https://pragmaticworks.com/courses/power-bi-for-finance-mastering-power-bi-for-financial-insights,2024-11-18,power bi for finance mastering power bi for financial insights,blog
pragmaticworks.com,https://pragmaticworks.com/courses/sql-server-high-availability,2024-11-18,sql server high availability,blog
pragmaticworks.com,https://pragmaticworks.com/blog/power-bi-custom-visuals-line-dot-chart,2023-03-28,power bi custom visuals line dot chart,blog
pragmaticworks.com,https://pragmaticworks.com/learn-with-the-nerds-no-code-chatbots-with-power-virtual-agents-recorded-live-event,2023-08-29,learn with the nerds no code chatbots with power virtual agents recorded live event,blog
pragmaticworks.com,https://pragmaticworks.com/blog/ssis-in-the-cloud-overview,2023-03-28,ssis in the cloud overview,blog
pragmaticworks.com,https://pragmaticworks.com/advanced-power-automate,2023-08-07,advanced power automate,blog
pragmaticworks.com,https://pragmaticworks.com/events/mar-27-virtual-advanced-data-visualizations-207,2024-11-05,mar 27 virtual advanced data visualizations 207,blog
pragmaticworks.com,https://pragmaticworks.com/learn-with-the-nerds-dax-made-easy-visual-calculations-in-power-bi-recorded-live-event,2024-04-11,learn with the nerds dax made easy visual calculations in power bi recorded live event,blog
pragmaticworks.com,https://pragmaticworks.com/lp-thank-you-page,2024-06-17,lp thank you page,blog
pragmaticworks.com,https://pragmaticworks.com/guides/dax-guide/aggregate-functions/dax-guide-min/counta,2025-03-06,counta,blog
pragmaticworks.com,https://pragmaticworks.com/guides/dax-guide/aggregate-functions/dax-guide-max/distinctcountnoblank,2025-03-06,distinctcountnoblank,blog
pragmaticworks.com,https://pragmaticworks.com/odl-renewal,2025-03-25,odl renewal,blog
pragmaticworks.com,https://pragmaticworks.com/blog/this-week-in-data-getting-started-with-azure,2024-08-27,this week in data getting started with azure,blog
pragmaticworks.com,https://pragmaticworks.com/courses/introduction-to-azure-logic-apps,2024-11-18,introduction to azure logic apps,blog
pragmaticworks.com,https://pragmaticworks.com/blog/table-partitioning-in-sql-server-partition-switching,2023-09-19,table partitioning in sql server partition switching,blog
pragmaticworks.com,https://pragmaticworks.com/courses/learn-with-the-nerds-understanding-dax-concepts-with-power-bi-recorded-live-event,2024-11-18,learn with the nerds understanding dax concepts with power bi recorded live event,blog
pragmaticworks.com,https://pragmaticworks.com/power-query-for-business,2023-08-29,power query for business,blog
pragmaticworks.com,https://pragmaticworks.com/events/sep-09-virtual-power-bi-bootcamp-129,2024-04-18,sep 09 virtual power bi bootcamp 129,blog
pragmaticworks.com,https://pragmaticworks.com/blog/3-reasons-why-you-should-move-youre-business-to-the-cloud,2023-03-28,3 reasons why you should move youre business to the cloud,blog
pragmaticworks.com,https://pragmaticworks.com/blog/power-bi-organizational-visuals-with-fabric-admin-tools,2024-09-27,power bi organizational visuals with fabric admin tools,blog
pragmaticworks.com,https://pragmaticworks.com/blog/ssas-multidimensional-vs-tabular-part-1,2024-06-17,ssas multidimensional vs tabular part 1,blog
pragmaticworks.com,https://pragmaticworks.com/guides/dax-guide/aggregate-functions/dax-guide-min/productx,2025-03-06,productx,blog
pragmaticworks.com,https://pragmaticworks.com/blog/meet-the-newest-member-of-our-training-team,2023-03-28,meet the newest member of our training team,blog
pragmaticworks.com,https://pragmaticworks.com/power-pages-in-a-day,2024-05-10,power pages in a day,blog
pragmaticworks.com,https://pragmaticworks.com/lwtn-power-platform-co-pilot-and-ai-builder-thank-you,2023-10-19,lwtn power platform co pilot and ai builder thank you,blog
pragmaticworks.com,https://pragmaticworks.com/blog/power-bi-custom-visuals-scatter-chart-by-akvelon,2023-03-28,power bi custom visuals scatter chart by akvelon,blog
pragmaticworks.com,https://pragmaticworks.com/guides/dax-guide/aggregate-functions/dax-guide-average1-3/productx,2025-03-06,productx,blog
pragmaticworks.com,https://pragmaticworks.com/blog/power-bi-custom-visuals-stars,2023-03-28,power bi custom visuals stars,blog
pragmaticworks.com,https://pragmaticworks.com/blog/the-best-kept-secret-in-the-azure-cloud,2023-03-28,the best kept secret in the azure cloud,blog
pragmaticworks.com,https://pragmaticworks.com/automation-in-a-day,2024-04-11,automation in a day,blog
pragmaticworks.com,https://pragmaticworks.com/advanced-data-modeling-with-power-bi,2024-07-09,advanced data modeling with power bi,blog
pragmaticworks.com,https://pragmaticworks.com/blog/power-bi-monthly-digest-december-2018,2023-03-28,power bi monthly digest december 2018,blog
pragmaticworks.com,https://pragmaticworks.com/blog/the-top-5-power-bi-visual-updates-you-have-to-try,2023-12-28,the top 5 power bi visual updates you have to try,blog
pragmaticworks.com,https://pragmaticworks.com/courses/bookings-brilliance-mastering-microsoft-bookings,2024-11-18,bookings brilliance mastering microsoft bookings,blog
pragmaticworks.com,https://pragmaticworks.com/training/private-training/hackathon,2024-05-01,hackathon,blog
pragmaticworks.com,https://pragmaticworks.com/blog/power-bi-custom-visuals-rotating-tile,2023-03-28,power bi custom visuals rotating tile,blog
pragmaticworks.com,https://pragmaticworks.com/learn-with-the-nerds-power-bi-developer-of-the-future-with-fabric-recorded-live-event,2024-04-11,learn with the nerds power bi developer of the future with fabric recorded live event,blog
pragmaticworks.com,https://pragmaticworks.com/events/may-05-virtual-microsoft-excel-bootcamp-224,2024-12-23,may 05 virtual microsoft excel bootcamp 224,blog
pragmaticworks.com,https://pragmaticworks.com/blog/introduction-to-managed-metadata-in-sharepoint,2024-04-26,introduction to managed metadata in sharepoint,blog
pragmaticworks.com,https://pragmaticworks.com/blog/power-bi-custom-visuals-hexbin-scatterplot,2023-03-28,power bi custom visuals hexbin scatterplot,blog
pragmaticworks.com,https://pragmaticworks.com/blog/how-to-edit-power-bi-live-connection-without-destroying-everything,2024-10-04,how to edit power bi live connection without destroying everything,blog
pragmaticworks.com,https://pragmaticworks.com/bootcamps,2025-01-02,bootcamps,blog
pragmaticworks.com,https://pragmaticworks.com/events/sep-09-virtual-power-automate-bootcamp-130,2024-04-18,sep 09 virtual power automate bootcamp 130,blog
pragmaticworks.com,https://pragmaticworks.com/guides/dax-guide/aggregate-functions/dax-guide-min/product,2025-03-06,product,blog
pragmaticworks.com,https://pragmaticworks.com/blog/ssis-loading-dimension-tables,2024-04-23,ssis loading dimension tables,blog
pragmaticworks.com,https://pragmaticworks.com/blog/device-management-with-azure-iot-hub,2023-03-28,device management with azure iot hub,blog
pragmaticworks.com,https://pragmaticworks.com/blog/auto-ml-in-power-bi-without-premium,2023-03-28,auto ml in power bi without premium,blog
pragmaticworks.com,https://pragmaticworks.com/blog/using-web-source-nfl-stats-in-data-analysis,2023-03-28,using web source nfl stats in data analysis,blog
pragmaticworks.com,https://pragmaticworks.com/guides-old/countax-dax-function,2025-02-11,countax dax function,blog
pragmaticworks.com,https://pragmaticworks.com/blog/exposure-data-audit-questions-and-answers,2024-06-04,exposure data audit questions and answers,blog
pragmaticworks.com,https://pragmaticworks.com/introduction-to-the-data-lakehouse-with-azure-synapse,2023-09-14,introduction to the data lakehouse with azure synapse,blog
pragmaticworks.com,https://pragmaticworks.com/ssis-in-the-cloud,2023-08-29,ssis in the cloud,blog
pragmaticworks.com,https://pragmaticworks.com/blog/power-bi-custom-visuals-dial-gauge,2023-03-28,power bi custom visuals dial gauge,blog
pragmaticworks.com,https://pragmaticworks.com/blog/lets-build-a-power-app-session-5,2023-03-28,lets build a power app session 5,blog
pragmaticworks.com,https://pragmaticworks.com/courses/modern-excel-analyst-in-a-day,2024-11-18,modern excel analyst in a day,blog
pragmaticworks.com,https://pragmaticworks.com/blog/this-week-in-data-mastering-the-tech-interview,2024-09-03,this week in data mastering the tech interview,blog
pragmaticworks.com,https://pragmaticworks.com/blog/ssas-multidimensional-vs-tabular-part-2,2024-08-13,ssas multidimensional vs tabular part 2,blog
pragmaticworks.com,https://pragmaticworks.com/instructors/manuel-quintana,2024-04-28,manuel quintana,blog
pragmaticworks.com,https://pragmaticworks.com/guides/dax-guide/aggregate-functions/dax-guide-count/sumx,2025-03-06,sumx,blog
pragmaticworks.com,https://pragmaticworks.com/courses/power-platform-administration,2024-11-18,power platform administration,blog
pragmaticworks.com,https://pragmaticworks.com/blog/managed-instances-subnet-deployment,2023-03-28,managed instances subnet deployment,blog
pragmaticworks.com,https://pragmaticworks.com/events/mar-20-learn-with-the-nerds-model-driven-apps-in-dataverse-249,2025-02-20,mar 20 learn with the nerds model driven apps in dataverse 249,blog
pragmaticworks.com,https://pragmaticworks.com/events/jul-15-virtual-advanced-data-modeling-118,2024-04-18,jul 15 virtual advanced data modeling 118,blog
pragmaticworks.com,https://pragmaticworks.com/blog/how-to-remove-links-from-power-bi-dashboard-service,2024-06-04,how to remove links from power bi dashboard service,blog
pragmaticworks.com,https://pragmaticworks.com/courses/introduction-to-microsoft-outlook,2024-11-18,introduction to microsoft outlook,blog
pragmaticworks.com,https://pragmaticworks.com/sql-server-stored-procedures,2023-08-29,sql server stored procedures,blog
pragmaticworks.com,https://pragmaticworks.com/blog/which-microsoft-project-plan-is-right-for-you,2024-07-24,which microsoft project plan is right for you,blog
pragmaticworks.com,https://pragmaticworks.com/guides-old/product-dax-function,2025-02-11,product dax function,blog
pragmaticworks.com,https://pragmaticworks.com/blog/power-bi-monthly-digest-june-2020,2023-03-28,power bi monthly digest june 2020,blog
pragmaticworks.com,https://pragmaticworks.com/blog/using-powershell-to-build-your-azure-vm-environment,2023-09-28,using powershell to build your azure vm environment,blog
pragmaticworks.com,https://pragmaticworks.com/events/sep-16-virtual-power-apps-bootcamp-132,2024-04-18,sep 16 virtual power apps bootcamp 132,blog
pragmaticworks.com,https://pragmaticworks.com/introduction-to-paginated-reports,2023-08-29,introduction to paginated reports,blog
pragmaticworks.com,https://pragmaticworks.com/blog/why-do-you-need-at-data-drive-culture,2023-03-28,why do you need at data drive culture,blog
pragmaticworks.com,https://pragmaticworks.com/blog/sql-advanced-threat-protection-threat-detection,2023-03-28,sql advanced threat protection threat detection,blog
pragmaticworks.com,https://pragmaticworks.com/blog/unlocking-azure-maps-discover-the-top-4-hidden-features,2024-04-29,unlocking azure maps discover the top 4 hidden features,blog
pragmaticworks.com,https://pragmaticworks.com/guides/dax-guide/aggregate-functions/dax-guide-count/countblank,2025-03-06,countblank,blog
pragmaticworks.com,https://pragmaticworks.com/blog/the-best-method-for-adoption-in-your-bi-reporting-and-analytics-projects,2023-03-28,the best method for adoption in your bi reporting and analytics projects,blog
pragmaticworks.com,https://pragmaticworks.com/blog/introducing-our-new-ai-with-power-bi-course,2023-03-16,introducing our new ai with power bi course,blog
pragmaticworks.com,https://pragmaticworks.com/blog/who-is-liz-hamilton,2024-09-03,who is liz hamilton,blog
pragmaticworks.com,https://pragmaticworks.com/blog/how-to-generate-pdfs-from-power-apps,2023-03-28,how to generate pdfs from power apps,blog
pragmaticworks.com,https://pragmaticworks.com/blog/azure-active-directory-and-resource-groups,2023-03-28,azure active directory and resource groups,blog
pragmaticworks.com,https://pragmaticworks.com/blog/power-bi-custom-visuals-image-timeline,2023-03-28,power bi custom visuals image timeline,blog
pragmaticworks.com,https://pragmaticworks.com/blog/power-bi-custom-visuals-waffle-chart,2023-03-28,power bi custom visuals waffle chart,blog
pragmaticworks.com,https://pragmaticworks.com/blog/how-to-implement-successful-bi-solutions,2023-03-28,how to implement successful bi solutions,blog
pragmaticworks.com,https://pragmaticworks.com/blog/leveraging-custom-labels-in-power-bi,2024-01-10,leveraging custom labels in power bi,blog
pragmaticworks.com,https://pragmaticworks.com/blog/exploring-microsoft-fabric-pipelines-with-teams-activity,2024-02-09,exploring microsoft fabric pipelines with teams activity,blog
pragmaticworks.com,https://pragmaticworks.com/blog/power-bi-monthly-digest-october2021,2023-03-16,power bi monthly digest october2021,blog
pragmaticworks.com,https://pragmaticworks.com/courses/learn-with-the-nerds-power-apps-live-hackathon-recorded-live-event,2024-11-18,learn with the nerds power apps live hackathon recorded live event,blog
pragmaticworks.com,https://pragmaticworks.com/blog/controlling-project-chaos-with-azure-devops,2023-03-28,controlling project chaos with azure devops,blog
pragmaticworks.com,https://pragmaticworks.com/events/may-23-virtual-power-bi-administration-234,2024-12-23,may 23 virtual power bi administration 234,blog
pragmaticworks.com,https://pragmaticworks.com/blog/announcing-our-new-course-introduction-to-dax,2024-04-23,announcing our new course introduction to dax,blog
pragmaticworks.com,https://pragmaticworks.com/master-the-ms-900-microsoft-365-fundamentals,2024-05-15,master the ms 900 microsoft 365 fundamentals,blog
pragmaticworks.com,https://pragmaticworks.com/blog/row-column-and-table-level-security-in-power-bi,2023-03-28,row column and table level security in power bi,blog
pragmaticworks.com,https://pragmaticworks.com/blog/power-bi-custom-visuals-slim-data-bar,2023-03-28,power bi custom visuals slim data bar,blog
pragmaticworks.com,https://pragmaticworks.com/blog/national-sports-organization-tranforms-reporting-by-migrating-to-powerbi,2023-03-28,national sports organization tranforms reporting by migrating to powerbi,blog
pragmaticworks.com,https://pragmaticworks.com/lwtn-power-platform-co-pilot-and-ai-builder-registration,2023-09-27,lwtn power platform co pilot and ai builder registration,blog
pragmaticworks.com,https://pragmaticworks.com/microsoft-designer,2024-04-11,microsoft designer,blog
pragmaticworks.com,https://pragmaticworks.com/delta-lake-in-databricks,2023-08-29,delta lake in databricks,blog
pragmaticworks.com,https://pragmaticworks.com/blog/this-week-in-data-pizza-and-the-cloud,2024-09-03,this week in data pizza and the cloud,blog
pragmaticworks.com,https://pragmaticworks.com/guides/dax-guide/aggregate-functions/dax-guide-max/min,2025-03-06,min,blog
pragmaticworks.com,https://pragmaticworks.com/blog/ssas-multidimensional-or-ssas-tabular-questions,2024-06-17,ssas multidimensional or ssas tabular questions,blog
pragmaticworks.com,https://pragmaticworks.com/courses/introduction-to-canvas-apps-with-power-apps,2024-11-18,introduction to canvas apps with power apps,blog
pragmaticworks.com,https://pragmaticworks.com/blog/introduction-to-dax,2024-05-21,introduction to dax,blog
pragmaticworks.com,https://pragmaticworks.com/learn-with-the-nerds-building-your-first-canvas-power-app-recorded-live-event,2023-08-29,learn with the nerds building your first canvas power app recorded live event,blog
pragmaticworks.com,https://pragmaticworks.com/blog/2015-is-over-but-what-a-great-year,2024-05-28,2015 is over but what a great year,blog
pragmaticworks.com,https://pragmaticworks.com/blog/dax-cheat-sheet,2023-12-08,dax cheat sheet,blog
pragmaticworks.com,https://pragmaticworks.com/advanced-t-sql,2023-08-07,advanced t sql,blog
pragmaticworks.com,https://pragmaticworks.com/blog/azure-hybrid-and-security,2023-03-28,azure hybrid and security,blog
pragmaticworks.com,https://pragmaticworks.com/blog/power-bi-monthly-digest-march-2020,2023-03-28,power bi monthly digest march 2020,blog
pragmaticworks.com,https://pragmaticworks.com/courses/learn-with-the-nerds-power-bi-beginner-to-pro-education-edition,2024-11-18,learn with the nerds power bi beginner to pro education edition,blog
pragmaticworks.com,https://pragmaticworks.com/blog/take-control-over-your-flow-in-power-automate,2023-03-16,take control over your flow in power automate,blog
pragmaticworks.com,https://pragmaticworks.com/blog/power-bi-custom-visuals-calendar-visualization,2023-03-28,power bi custom visuals calendar visualization,blog
pragmaticworks.com,https://pragmaticworks.com/blog/unlocking-the-secrets-of-survey-data-in-power-bi,2024-10-18,unlocking the secrets of survey data in power bi,blog
pragmaticworks.com,https://pragmaticworks.com/blog/sumifs-in-excel,2023-11-13,sumifs in excel,blog
pragmaticworks.com,https://pragmaticworks.com/power-bi-with-azure-devops-integration,2023-09-14,power bi with azure devops integration,blog
pragmaticworks.com,https://pragmaticworks.com/blog/building-your-first-model-driven-application-in-powerapps,2023-03-28,building your first model driven application in powerapps,blog
pragmaticworks.com,https://pragmaticworks.com/blog/introduction-to-power-bi-for-educators-custom-visuals,2024-07-24,introduction to power bi for educators custom visuals,blog
pragmaticworks.com,https://pragmaticworks.com/events/jan-28-virtual-advanced-data-shaping-178,2024-08-26,jan 28 virtual advanced data shaping 178,blog
pragmaticworks.com,https://pragmaticworks.com/blog/new-feature-power-bi-subscriptions,2023-03-28,new feature power bi subscriptions,blog
pragmaticworks.com,https://pragmaticworks.com/blog/get-a-quick-start-on-power-bi-reports-with-power-query-builder,2023-03-28,get a quick start on power bi reports with power query builder,blog
pragmaticworks.com,https://pragmaticworks.com/blog/confident-cloud-migrations,2023-03-28,confident cloud migrations,blog
pragmaticworks.com,https://pragmaticworks.com/blog/a-new-feature-that-helps-manage-large-volumes-of-data,2023-03-28,a new feature that helps manage large volumes of data,blog
pragmaticworks.com,https://pragmaticworks.com/introduction-to-microsoft-outlook,2023-09-14,introduction to microsoft outlook,blog
pragmaticworks.com,https://pragmaticworks.com/courses/art-and-science-of-excel-modeling,2024-11-18,art and science of excel modeling,blog
pragmaticworks.com,https://pragmaticworks.com/blog/sending-a-text-from-power-apps,2023-03-28,sending a text from power apps,blog
pragmaticworks.com,https://pragmaticworks.com/dp-900-azure-data-fundamentals-review,2024-05-10,dp 900 azure data fundamentals review,blog
pragmaticworks.com,https://pragmaticworks.com/courses/advanced-data-modeling-with-power-bi,2024-11-18,advanced data modeling with power bi,blog
