website,loc,lastmod,cured_name
GuyInACube,https://www.youtube.com/watch?v=OFBL2PcVqQU,2024-12-19,Your Microsoft Fabric Is a Mess Without DOMAINS!
GuyInACube,https://www.youtube.com/watch?v=OlEqYeWfPeM,2024-12-18,OneLake Integration for Power BI Semantic Models
GuyInACube,https://www.youtube.com/watch?v=T9cc3USGipY,2024-12-14,"REPLAY Microsoft Power BI / Fabric Q&amp;A - LIVE (Dec 14, 2024)"
GuyInACube,https://www.youtube.com/watch?v=vKq9vNxH-24,2024-12-12,Tracing your Power BI Report
GuyInACube,https://www.youtube.com/watch?v=hlY4JhqU1nc,2024-12-11,Rebinding your Power BI Report with Semantic Link Labs
GuyInACube,https://www.youtube.com/watch?v=4yaUDHAi-WY,2024-12-05,Migrate your Power BI Semantic Models to Direct Lake
GuyInACube,https://www.youtube.com/watch?v=zIAvV1OIN6I,2024-12-04,Leverage Copy Job to copy in the latest file in Data Factory
GuyInACube,https://www.youtube.com/watch?v=liTy0eToSPg,2024-11-07,Edit your Direct Lake models directly in Power BI Desktop!
GuyInACube,https://www.youtube.com/watch?v=Bjd0RKL_KIw,2024-10-24,Power BI Desktop Gets a DARK MODE Makeover!
GuyInACube,https://www.youtube.com/watch?v=2_47DOwjCX0,2024-10-23,Why not a date and time table in Power BI instead?
GuyInACube,https://www.youtube.com/watch?v=T0nlsQ_hnRw,2024-10-17,A Few Ways GENERATE_SERIES Will Revolutionize Your Microsoft Fabric Warehouse Experience
GuyInACube,https://www.youtube.com/watch?v=WneMeSYMmFM,2024-10-02,Some GOTCHAs when using Mirroring in Microsoft Fabric
GuyInACube,https://www.youtube.com/watch?v=JMd1dVDrrTI,2024-09-26,Design Engaging Power BI Report Page Tooltips Effortlessly
GuyInACube,https://www.youtube.com/watch?v=sK9sA5ynYkI,2024-09-05,The Surprising Enhancements for DAX Query View in Power BI
GuyInACube,https://www.youtube.com/watch?v=iLYIx3QS508,2024-09-04,Expert Guide: GitHub Integration for Microsoft Fabric
GuyInACube,https://www.youtube.com/watch?v=TeutxliZVRU,2024-08-22,Which Microsoft Fabric SQL Analytics Endpoint should you use?
GuyInACube,https://www.youtube.com/watch?v=AGG1FdOWML8,2024-08-21,Dive into Power BI and Microsoft Fabric - IN PERSON - two events!
GuyInACube,https://www.youtube.com/watch?v=43bQYReo2q4,2024-07-28,"REPLAY Let&#39;s talk Microsoft Fabric - LIVE w/ Matthew Roche (July 27, 2024)"
GuyInACube,https://www.youtube.com/watch?v=aPrh4sK8CX4,2024-07-25,Happy little accidents with the Power BI Card Visual
GuyInACube,https://www.youtube.com/watch?v=HT_J1QiBLwA,2024-07-24,Creative way to use Sempy to update a Power BI report definition
GuyInACube,https://www.youtube.com/watch?v=4x0egkfZZJg,2024-07-21,"REPLAY Microsoft Fabric / Power BI Q&amp;A - LIVE (July 20, 2024)"
GuyInACube,https://www.youtube.com/watch?v=NRg4VkHSibU,2024-07-18,Overwhelmed with all the Microsoft Fabric Updates???
GuyInACube,https://www.youtube.com/watch?v=Fuk2FWYc8bs,2024-07-17,"Multiple DAX Measure updates in DAX Query View? Yes, Please!"
GuyInACube,https://www.youtube.com/watch?v=2yzBscO6GSc,2024-07-13,"REPLAY Microsoft Fabric / Power BI Q&amp;A - LIVE (July 13, 2024)"
GuyInACube,https://www.youtube.com/watch?v=qhnxJaLQAWk,2024-07-11,Discover Adam and Patrick&#39;s Epic 2024 Adventure
GuyInACube,https://www.youtube.com/watch?v=A1HM0_TevSg,2024-07-10,How to create a slick way to adjust your Power BI visual
GuyInACube,https://www.youtube.com/watch?v=OQKgnJkjJDI,2024-07-04,Leverage Power Query Parameters with Power BI Paginated reports
GuyInACube,https://www.youtube.com/watch?v=QI_5MD9qY2k,2024-07-03,Unlock Data Factory Power with Existing Connections
GuyInACube,https://www.youtube.com/watch?v=3O3VmBG0H94,2024-06-29,"REPLAY Microsoft Fabric / Power BI Q&amp;A - LIVE (June 29, 2024)"
GuyInACube,https://www.youtube.com/watch?v=6LvNrZpc9Q8,2024-06-20,Understanding Gateway Clusters in Microsoft Fabric
GuyInACube,https://www.youtube.com/watch?v=FbVh05_QlYo,2024-06-19,A look at the Microsoft Fabric Admin Portal
GuyInACube,https://www.youtube.com/watch?v=dz4bM_NzQQg,2024-06-13,Get started with the On-Premises Data Gateway in Microsoft Fabric
GuyInACube,https://www.youtube.com/watch?v=ftb2nN3eukg,2024-06-12,Get a custom endpoint without creating an EventHub for EventStreams
GuyInACube,https://www.youtube.com/watch?v=mXngl2ChBxM,2024-06-06,Update Data Sources within Deployment Pipelines
GuyInACube,https://www.youtube.com/watch?v=Noox00b8ZHo,2024-06-05,Reframe your Power BI Direct Lake Semantic Model
GuyInACube,https://www.youtube.com/watch?v=qIt2n46Qa7s,2024-05-30,Install Power BI Desktop the RIGHT WAY! (2024)
GuyInACube,https://www.youtube.com/watch?v=ZIu2bJxzsd8,2024-05-29,On-premises data with Data Factory in Microsoft Fabric
GuyInACube,https://www.youtube.com/watch?v=3GL_ZA3UnHA,2024-05-23,Ditch the whiteboard! Use Microsoft Fabric task flows!
GuyInACube,https://www.youtube.com/watch?v=-cGPyTq7Pq8,2024-05-22,Deliver your Power BI subscriptions to OneDrive or SharePoint!
GuyInACube,https://www.youtube.com/watch?v=RNd2MW3myWk,2024-05-18,"REPLAY Microsoft Fabric / Power BI Q&amp;A - LIVE (May 18, 2024)"
GuyInACube,https://www.youtube.com/watch?v=oamf3oztUAw,2024-05-15,Expert Tips for Managing OneLake Data Access in Microsoft Fabric
GuyInACube,https://www.youtube.com/watch?v=zLnJpXVBPIU,2024-05-11,"REPLAY Let&#39;s talk Microsoft Fabric - LIVE w/ Josh Caplan (May 11, 2024)"
GuyInACube,https://www.youtube.com/watch?v=xuEYxJ5gkGA,2024-05-09,Leverage RLS with Direct Lake in Microsoft Fabric without access to OneLake
GuyInACube,https://www.youtube.com/watch?v=nDH0fqAyUf4,2024-05-08,Unleash Your Power BI Mobile Audience Potential with Automated layouts!
GuyInACube,https://www.youtube.com/watch?v=R3vEFKtYfBI,2024-05-04,"REPLAY Let&#39;s talk Microsoft Fabric - LIVE w/ Matthew Roche (May 4, 2024)"
GuyInACube,https://www.youtube.com/watch?v=dEzq8LNcYdI,2024-05-02,Can&#39;t create a relationship? Time for a surrogate key in Power BI!
GuyInACube,https://www.youtube.com/watch?v=otRpzOZ8CBs,2024-05-01,Getting creative with a Line Chart in Power BI
GuyInACube,https://www.youtube.com/watch?v=iNm73rguVjY,2024-04-27,"REPLAY Microsoft Fabric / Power BI Q&amp;A w/ Kasper de Jonge (April 27, 2024)"
GuyInACube,https://www.youtube.com/watch?v=eqKvvbMPNTs,2024-04-20,"REPLAY Microsoft Fabric / Power BI Q&amp;A w/ Marco Russo LIVE (April 20, 2024)"
GuyInACube,https://www.youtube.com/watch?v=3WXwIC8j6Y8,2024-04-18,Wait?!? I can&#39;t conditionally format a Line Chart in Power BI?
GuyInACube,https://www.youtube.com/watch?v=zspWD9Cx1UI,2024-04-17,When Sorting Fails: Dynamic Formatting mistakes with Measures
GuyInACube,https://www.youtube.com/watch?v=3L69Mk3mvFM,2024-04-10,At last!!! Power Query within Power BI Report Builder!
GuyInACube,https://www.youtube.com/watch?v=IjC782SomBI,2024-04-06,"REPLAY Microsoft Fabric / Power BI Q&amp;A - LIVE (April 6, 2024)"
GuyInACube,https://www.youtube.com/watch?v=TgAXt1ifdhs,2024-04-04,Boost DAX Performance in Power BI with Dual Mode
GuyInACube,https://www.youtube.com/watch?v=MJqMqbyUAgI,2024-04-03,Wait!?! It&#39;s the same data source! What&#39;s going on???
GuyInACube,https://www.youtube.com/watch?v=BKDSsCzRDMw,2024-03-30,REPLAY Microsoft Fabric / Power BI Q&amp;A - LIVE
GuyInACube,https://www.youtube.com/watch?v=0kE3TE34oLM,2024-03-28,Copilot for Power BI: Your Ultimate Copilot Guide
GuyInACube,https://www.youtube.com/watch?v=J0CAiFQh7oo,2024-03-27,Power BI Dynamic Subscriptions - The New Way!
GuyInACube,https://www.youtube.com/watch?v=x4afF_Ou58Y,2024-03-21,How to connect to Microsoft Fabric Items from Power BI Desktop?
GuyInACube,https://www.youtube.com/watch?v=twT9BERneMI,2024-03-20,Decoding Direct Lake: The Truth Behind DirectQuery Fallback
GuyInACube,https://www.youtube.com/watch?v=1VJd5TsupXM,2024-03-16,"REPLAY Microsoft Fabric / Power BI Q&amp;A - LIVE (Mar 16, 2024)"
GuyInACube,https://www.youtube.com/watch?v=-_jY87oo9Sw,2024-03-14,Include in Refresh can trip you up within Power Query
GuyInACube,https://www.youtube.com/watch?v=Tw-n4o5LErw,2024-03-13,Dive into Microsoft Fabric&#39;s Power BI Direct Lake
GuyInACube,https://www.youtube.com/watch?v=eDRgzEVwVEc,2024-03-07,Getting started with Visual Calcs in Power BI
GuyInACube,https://www.youtube.com/watch?v=U0_JPX0q4Es,2024-03-06,Uncovering OneLake&#39;s Secrets with Delta Analyzer in Microsoft Fabric
GuyInACube,https://www.youtube.com/watch?v=iC7BsYH9EKE,2024-03-02,"REPLAY Microsoft Fabric / Power BI Q&amp;A - LIVE (Mar 2, 2024)"
GuyInACube,https://www.youtube.com/watch?v=wNxVw_yLy0s,2024-02-29,All Code!!! Extract ZIP files with Notebooks in Microsoft Fabric
GuyInACube,https://www.youtube.com/watch?v=fgOlMbTfFd4,2024-02-28,NO CODE extract ZIP files with Pipelines in Microsoft Fabric
GuyInACube,https://www.youtube.com/watch?v=pozbeRMNCJo,2024-02-24,"REPLAY Microsoft Fabric / Power BI Q&amp;A - LIVE (Feb 24, 2024)"
GuyInACube,https://www.youtube.com/watch?v=SyRDll6OvX0,2024-02-21,Creating your first EVENTSTREAM in Microsoft Fabric
GuyInACube,https://www.youtube.com/watch?v=gNuFFR-inic,2024-02-17,"REPLAY Microsoft Fabric / Power BI Q&amp;A - LIVE (Feb 17, 2023)"
GuyInACube,https://www.youtube.com/watch?v=uBJw7_zvXEo,2024-02-08,Why can&#39;t I edit my Power BI semantic model?
GuyInACube,https://www.youtube.com/watch?v=2RuoHpNZbc4,2024-02-07,Adding a column to your Lakehouse? Where is it in the Semantic Model???
GuyInACube,https://www.youtube.com/watch?v=iB_OLO81vgc,2024-02-06,Join us at SQLBits 2024 and save 10%!
GuyInACube,https://www.youtube.com/watch?v=XOfzgjWyv90,2024-02-03,"REPLAY Microsoft Fabric / Power BI Q&amp;A - LIVE (Feb 3, 2023)"
GuyInACube,https://www.youtube.com/watch?v=8UNQ4pQXuEE,2024-02-01,Power BI Tips: Excluding Top N with DAX
GuyInACube,https://www.youtube.com/watch?v=zvyr2qYCQNo,2024-01-31,Use Source Control with your Power BI Report in Microsoft Fabric!
GuyInACube,https://www.youtube.com/watch?v=lLfDJvvTDZs,2024-01-30,Where in the world are Adam and Patrick?
GuyInACube,https://www.youtube.com/watch?v=ESRJ9pZ_3FY,2024-01-27,"REPLAY Microsoft Fabric / Power BI Q&amp;A - LIVE (Jan 27, 2023)"
GuyInACube,https://www.youtube.com/watch?v=Cg6zRhwF-Ro,2024-01-25,Can you use Field Parameters with Direct Lake in Power BI?
GuyInACube,https://www.youtube.com/watch?v=Gc-hDQyeaYY,2024-01-24,Join us at the Microsoft Fabric Community Conference! Get $100 OFF!
GuyInACube,https://www.youtube.com/watch?v=MDJWUg9642Y,2024-01-20,"REPLAY Microsoft Fabric / Power BI Q&amp;A - LIVE (Jan 20, 2023)"
GuyInACube,https://www.youtube.com/watch?v=udzsJqUZPrY,2024-01-18,Power BI Tutorial for Beginners (2024)
GuyInACube,https://www.youtube.com/watch?v=U3aqC7VQTSw,2024-01-17,Get Your DP-600 the Smart Way: Microsoft Fabric Career Hub
GuyInACube,https://www.youtube.com/watch?v=sINPHVa0Kds,2024-01-13,"REPLAY Let&#39;s talk Microsoft Fabric - LIVE w/ Matthew Roche (Jan 13, 2024)"
GuyInACube,https://www.youtube.com/watch?v=W1geyI4pCNo,2024-01-11,What happens to the incremental data???
GuyInACube,https://www.youtube.com/watch?v=uuIznvWX3zw,2024-01-10,Incremental Refresh with your Warehouse without a date in Microsoft Fabric
GuyInACube,https://www.youtube.com/watch?v=BDZxBHQVPpY,2024-01-06,"REPLAY Starting off 2024! Microsoft Fabric LIVE Q&amp;A (Jan 6, 2024)"
GuyInACube,https://www.youtube.com/watch?v=NBxdctrTlkY,2024-01-04,9 hidden gems about On-Object Editing in Power BI
GuyInACube,https://www.youtube.com/watch?v=tQrr7RPSvsQ,2024-01-03,Thinking about your DAX Queries like a SQL Query in Power BI
GuyInACube,https://www.youtube.com/watch?v=ufhG59y4N1Q,2023-12-16,"REPLAY Microsoft Fabric / Power BI Q&amp;A - LIVE w/ Kim Manis &amp; Bogdan Crivat (Dec 16, 2023)"
GuyInACube,https://www.youtube.com/watch?v=GFENAFw1co4,2023-12-14,"Create a measure from a filtered visual in Power BI? Of Course, you can!"
GuyInACube,https://www.youtube.com/watch?v=jouBo0AzbvQ,2023-12-13,Exploring Custom Spark Pools in Microsoft Fabric Lakehouses
GuyInACube,https://www.youtube.com/watch?v=XQQZm--eR4Y,2023-12-09,"REPLAY Microsoft Fabric / Power BI Q&amp;A - LIVE (Dec 9, 2023)"
GuyInACube,https://www.youtube.com/watch?v=MdmPjZAV9I8,2023-12-07,Control ACCESS to your Microsoft Fabric Lakehouse or Warehouse
GuyInACube,https://www.youtube.com/watch?v=oPGGYLKhTOA,2023-12-06,Boost your productivity with DAX Query View in Power BI Desktop!
GuyInACube,https://www.youtube.com/watch?v=zQ3jxOdYQlo,2023-12-02,"REPLAY Microsoft Fabric / Power BI Q&amp;A - LIVE (Dec 2, 2023)"
GuyInACube,https://www.youtube.com/watch?v=K2WdIdfpIic,2023-11-30,Let&#39;s look at using some PySpark in your first Microsoft Fabric Notebook
GuyInACube,https://www.youtube.com/watch?v=40Lwg1QJFEY,2023-11-16,Digging deeper into Data Activator in Microsoft Fabric
GuyInACube,https://www.youtube.com/watch?v=AyYDLTvoXNk,2023-11-15,Leverage OneLake with Azure Databricks
GuyInACube,https://www.youtube.com/watch?v=jFr-o953dmk,2023-11-11,"REPLAY Microsoft Fabric / Power BI Q&amp;A - LIVE (Nov 11, 2023)"
GuyInACube,https://www.youtube.com/watch?v=nHc0H1B6qZI,2023-11-04,"REPLAY Microsoft Fabric / Power BI Q&amp;A - LIVE (Nov 4, 2023)"
GuyInACube,https://www.youtube.com/watch?v=v6IOuysQGRA,2023-11-02,Unleash the Potential of Data Activator in Microsoft Fabric
GuyInACube,https://www.youtube.com/watch?v=lY7aQpxnIJE,2023-11-01,Why On-Object Editing in Power BI???
GuyInACube,https://www.youtube.com/watch?v=XwRcaNLWpYg,2023-10-28,"REPLAY Microsoft Fabric / Power BI Q&amp;A w/ Marco Russo LIVE (October 28, 2023)"
GuyInACube,https://www.youtube.com/watch?v=QzG7DFaAYng,2023-10-26,The Secret to Data-Driven Dynamic Subscriptions in Paginated Reports
GuyInACube,https://www.youtube.com/watch?v=776uk-i0PWU,2023-10-25,Mind-Blowing Power BI Update: Model View enhancements!
GuyInACube,https://www.youtube.com/watch?v=0qmHl-oAehI,2023-10-21,"REPLAY Microsoft Fabric / Power BI Q&amp;A - LIVE (Oct 21, 2023)"
GuyInACube,https://www.youtube.com/watch?v=zMiRGZsfQgs,2023-10-19,Finish the Puzzle: Querying Power BI Semantic Models with Semantic Link!
GuyInACube,https://www.youtube.com/watch?v=hFfi3O_Isn4,2023-10-17,Escape the Ordinary with a Low Code Lakehouse in Microsoft Fabric
GuyInACube,https://www.youtube.com/watch?v=Ite05gBQA9Q,2023-10-14,"REPLAY Microsoft Fabric / Power BI Q&amp;A - LIVE (Oct 14, 2023)"
GuyInACube,https://www.youtube.com/watch?v=W7Ab1PIAwGk,2023-10-04,Discover the Untapped Settings in Power BI Desktop
GuyInACube,https://www.youtube.com/watch?v=03Tf1tKNzfY,2023-09-29,The secret whereabouts of Adam &amp; Patrick revealed!
GuyInACube,https://www.youtube.com/watch?v=Ww7pqhajkbY,2023-09-27,Mastering Power BI Desktop: A Deep Dive into the Pane Switcher
GuyInACube,https://www.youtube.com/watch?v=UU51e--zq9c,2023-09-21,Editing your Direct Lake Datasets from Tabular Editor? Yes please!
GuyInACube,https://www.youtube.com/watch?v=ECmhdB5Rdzo,2023-09-20,Using Microsoft Fabric Workspaces (Power BI and more!)
GuyInACube,https://www.youtube.com/watch?v=gMLwKdfSmu0,2023-09-07,No more Report Builder for Power BI Paginated Reports???
GuyInACube,https://www.youtube.com/watch?v=s1W3UY3v7rc,2023-09-06,Landing data with Dataflows Gen2 in Microsoft Fabric
GuyInACube,https://www.youtube.com/watch?v=StIBBb69wDw,2023-09-05,Creating your first Data Warehouse in Microsoft Fabric
GuyInACube,https://www.youtube.com/watch?v=GLNqNuON3Fc,2023-09-02,"REPLAY Microsoft Fabric/Power BI Q&amp;A - LIVE (Sept 2, 2023)"
GuyInACube,https://www.youtube.com/watch?v=Y63Sj2NSdic,2023-08-31,A quirky Bookmark scenario with Filters in Power BI. Pay Attention!
GuyInACube,https://www.youtube.com/watch?v=1yYYY_yqqZE,2023-08-30,Wait! We can use Databricks data with Microsoft Fabric???
GuyInACube,https://www.youtube.com/watch?v=biISm1ZjouA,2023-08-29,The POWER of shortcuts in Microsoft Fabric
GuyInACube,https://www.youtube.com/watch?v=JDFhipHmxMA,2023-08-25,Join us at PASS Data Community Summit 2023
GuyInACube,https://www.youtube.com/watch?v=4fJq8qessuM,2023-08-24,Power BI has Copilot already? For DAX it does!
GuyInACube,https://www.youtube.com/watch?v=IZDacEcbfog,2023-08-23,Get your measures organized in Power BI
GuyInACube,https://www.youtube.com/watch?v=LZ9nKK0PPe0,2023-08-22,Get and use Python Libraries within Microsoft Fabric
GuyInACube,https://www.youtube.com/watch?v=AWiN_XxvNWY,2023-08-19,"REPLAY Let&#39;s talk Microsoft Fabric - LIVE w/ Matthew Roche (Aug 19, 2023)"
GuyInACube,https://www.youtube.com/watch?v=G_v1DyZoP_s,2023-08-18,Saying goodbye...
GuyInACube,https://www.youtube.com/watch?v=QV6b8CKNhzU,2023-08-17,Using Figma to wireframe your Power BI reports
GuyInACube,https://www.youtube.com/watch?v=k7pZzwgXW-g,2023-08-16,Enabling Power BI Paginated Report Drill!
GuyInACube,https://www.youtube.com/watch?v=Ge0VWZMa50I,2023-08-15,Is Data Wrangler the Power Query of Python?
GuyInACube,https://www.youtube.com/watch?v=JNfQJe-ruxM,2023-08-12,"REPLAY We&#39;re back! Let&#39;s answer your Microsoft Fabric and Power BI questions... (August 12, 2023)"
GuyInACube,https://www.youtube.com/watch?v=ZrsrLEY_Gf8,2023-07-12,The MAGIC of Power BI in PowerPoint!
GuyInACube,https://www.youtube.com/watch?v=4NbuG1JBq60,2023-07-11,Leveraging OneLake Explorer - The OneDrive of Data! (Microsoft Fabric)
GuyInACube,https://www.youtube.com/watch?v=RaHAoZD2mZE,2023-06-29,Create MEANINGFUL data labels with measures in Power BI
GuyInACube,https://www.youtube.com/watch?v=ilTeVH2Cwck,2023-06-28,Can you use Power Query Dynamic M Parameters for multi-select?
GuyInACube,https://www.youtube.com/watch?v=DB8zujLjzVo,2023-06-27,SQL Server in Microsoft Fabric? Use CETaS to move data!
GuyInACube,https://www.youtube.com/watch?v=WWvs0Z4zTGw,2023-06-24,"REPLAY Microsoft Fabric/Power BI Q&amp;A - LIVE (June 24, 2023)"
GuyInACube,https://www.youtube.com/watch?v=N11LneTF8-4,2023-06-22,Digging into DYNAMIC format strings for DAX Measures in Power BI
GuyInACube,https://www.youtube.com/watch?v=LDZL0gyHQbs,2023-06-21,Get the most as a Data Scientist with Microsoft Fabric (Public Preview)
GuyInACube,https://www.youtube.com/watch?v=_-rxBAtFFOA,2023-06-20,"Your data is in the Lakehouse, but now what? | Microsoft Fabric (Public Preview)"
GuyInACube,https://www.youtube.com/watch?v=piv6I5ohH6k,2023-06-17,"REPLAY Microsoft Fabric/Power BI Q&amp;A - LIVE (June 17, 2023)"
GuyInACube,https://www.youtube.com/watch?v=fvuL8Nk_gxU,2023-06-15,What does Microsoft Fabric mean for Power BI?
GuyInACube,https://www.youtube.com/watch?v=Q8NfZCFKCmw,2023-06-14,Understanding the TIMELINE in DAX Studio
GuyInACube,https://www.youtube.com/watch?v=SFta1_70T_U,2023-06-13,Create your FIRST Lakehouse in Microsoft Fabric
GuyInACube,https://www.youtube.com/watch?v=hUfdMc0GW8s,2023-06-10,"REPLAY Let&#39;s talk Microsoft Fabric - LIVE w/ Amir Netz (June 10, 2023)"
GuyInACube,https://www.youtube.com/watch?v=6AAeV3bSMso,2023-06-08,Understanding Microsoft Fabric Licensing and Cost (Public Preview)
GuyInACube,https://www.youtube.com/watch?v=2bGb0QCLebw,2023-06-07,Use your browser to edit your Power BI dataset within Microsoft Fabric
GuyInACube,https://www.youtube.com/watch?v=wEcRTSNhtLg,2023-06-06,Understanding OneLake within Microsoft Fabric
GuyInACube,https://www.youtube.com/watch?v=VdwsJ-Ix-oc,2023-06-01,Leverage the Microsoft Fabric Trial
GuyInACube,https://www.youtube.com/watch?v=zG2yyJzMooM,2023-05-31,Why can&#39;t I use Microsoft Fabric?
GuyInACube,https://www.youtube.com/watch?v=-f0XIVEP7bE,2023-05-30,What is Microsoft Fabric (Public Preview)?
GuyInACube,https://www.youtube.com/watch?v=5pg9MlQy9cE,2023-05-27,"REPLAY Let&#39;s talk Microsoft Fabric - LIVE w/ Matthew Roche (May 27, 2023)"
GuyInACube,https://www.youtube.com/watch?v=wdDx0-jvl7w,2023-05-25,Microsoft Fabric Launch Digital Event (Day 2)
GuyInACube,https://www.youtube.com/watch?v=6QusOchmSXQ,2023-05-25,What does Microsoft Fabric mean for Guy in a Cube?
GuyInACube,https://www.youtube.com/watch?v=tMx3rhl43b4,2023-05-24,REPLAY Microsoft Fabric Discussion - May 2023 Social Hour
GuyInACube,https://www.youtube.com/watch?v=5jlP0wdEsls,2023-05-24,Microsoft Fabric Launch Digital Event (Day 1)
GuyInACube,https://www.youtube.com/watch?v=TprbclJaSJU,2023-05-22,Don’t miss out of Microsoft Build! #powerbi
GuyInACube,https://www.youtube.com/watch?v=nY54EX6_vd0,2023-05-20,"REPLAY Power BI tips from the Pros - LIVE (May 20, 2023)"
GuyInACube,https://www.youtube.com/watch?v=pM7LUBfkpDs,2023-05-18,What does Tooltip Auto-scale actually do in your Power BI Report?
GuyInACube,https://www.youtube.com/watch?v=eYxRHJ0hB_E,2023-05-17,Enabling Drillthrough with Power BI On-Object Editing
GuyInACube,https://www.youtube.com/watch?v=m2lYsQ9t-5k,2023-05-16,Are you using your licenses correct? See where Azure Hybrid Benefits can help!
GuyInACube,https://www.youtube.com/watch?v=pKkav_W-jiQ,2023-05-11,Want a BEAUTIFUL Power BI Report? Start here!
GuyInACube,https://www.youtube.com/watch?v=8vGwBedcXQA,2023-05-10,Why is there a limited relationship when using the same data source?
GuyInACube,https://www.youtube.com/watch?v=AbiYgh9RD2U,2023-05-09,Controlling cost with Azure Synapse Serverless Pools
GuyInACube,https://www.youtube.com/watch?v=N2WLzB8GOlk,2023-05-06,"REPLAY Power BI tips from the Pros - LIVE (May 6, 2023)"
GuyInACube,https://www.youtube.com/watch?v=ZKodkcOb3WI,2023-05-04,The HEART of Power BI
GuyInACube,https://www.youtube.com/watch?v=WyvfZMaXLBs,2023-05-03,RLS in the source? How does this work with DirectQuery and Import in Power BI?
GuyInACube,https://www.youtube.com/watch?v=uXes0AEQJps,2023-05-02,How to SCHEDULE your notebooks to run with Azure Synapse
GuyInACube,https://www.youtube.com/watch?v=K6DpOJM6b7E,2023-04-20,ChatGPT blew my mind with this Power BI scenario
GuyInACube,https://www.youtube.com/watch?v=xL6DvHYjBVs,2023-04-19,3 tips for the new On-Object editing of a Power BI visual
GuyInACube,https://www.youtube.com/watch?v=ldTeS-yxpSE,2023-04-18,Loop through a list using pySpark for your Azure Synapse Pipelines
GuyInACube,https://www.youtube.com/watch?v=YkNgmVdTD8E,2023-04-15,"REPLAY Power BI tips from the Pros - LIVE (April 15, 2023)"
GuyInACube,https://www.youtube.com/watch?v=owSaH3DlRrw,2023-04-13,Minimize diagnostics steps by just using the VPAX file!
GuyInACube,https://www.youtube.com/watch?v=7riWWVMMegE,2023-04-12,How to easily compare Server Timings using DAX Studio for your Power BI dataset
GuyInACube,https://www.youtube.com/watch?v=Ks4ekJeKjZY,2023-04-11,Use Azure SQL Managed Instance Link to have a Read Replica in the cloud!
GuyInACube,https://www.youtube.com/watch?v=iaekrjvr3Xk,2023-04-08,"REPLAY Power BI tips from the Pros - LIVE (April 8, 2023)"
GuyInACube,https://www.youtube.com/watch?v=H6sLCVanIYE,2023-04-06,Where are the Power BI Gateway logs? I thought I knew...
GuyInACube,https://www.youtube.com/watch?v=Hpx52kOodPc,2023-04-05,Setup a Reverse Hybrid Table without using Tabular Editor for Power BI!
GuyInACube,https://www.youtube.com/watch?v=k280CpPKJgc,2023-04-04,Convert CSV to Parquet using pySpark in Azure Synapse Analytics
GuyInACube,https://www.youtube.com/watch?v=gnTaUbIMfyM,2023-04-01,"REPLAY Power BI tips from the Pros - LIVE (April 1, 2023)"
GuyInACube,https://www.youtube.com/watch?v=X_1tBbPwBMg,2023-03-29,Switch a Power BI Report&#39;s dataset without needing Premium!
GuyInACube,https://www.youtube.com/watch?v=heY92V11knc,2023-03-25,REPLAY Power BI Adoption and More Q&amp;A with Melissa Coates and Matthew Roche!
GuyInACube,https://www.youtube.com/watch?v=twgsMDuwOuo,2023-03-23,Visually see where you BROKE the fold in Power Query
GuyInACube,https://www.youtube.com/watch?v=fh8HpSNNP30,2023-03-22,Checking out the new Power BI RLS Editor
GuyInACube,https://www.youtube.com/watch?v=yvV6z6OInEI,2023-03-21,What&#39;s a Junk Dimension and when should you use it?
GuyInACube,https://www.youtube.com/watch?v=zJopprZC-bE,2023-03-16,How do THIN reports work with Power BI Deployment Pipelines?
GuyInACube,https://www.youtube.com/watch?v=9wLFlaaPJgk,2023-03-15,Art of the Possible with Power Platform and Azure Synapse
GuyInACube,https://www.youtube.com/watch?v=k-4Oud9jkuw,2023-03-09,Dataset permissions required for App report in Power BI? What am I missing??? (Re-Upload)
GuyInACube,https://www.youtube.com/watch?v=YOWxvT5XLoc,2023-03-08,The POWER of Microsoft Lists and Power BI
GuyInACube,https://www.youtube.com/watch?v=9SprbLQpW8I,2023-03-07,Start Learning T-SQL for Azure Database and Azure Synapse
GuyInACube,https://www.youtube.com/watch?v=leT_dkXwE1c,2023-03-02,The MAGIC of Microsoft Teams + Power BI
GuyInACube,https://www.youtube.com/watch?v=w_rSlWELBNk,2023-03-01,Getting Crazy with the Power Query UI
GuyInACube,https://www.youtube.com/watch?v=Pdbc_Q7pnD8,2023-02-23,Different ways to work with Microsoft Excel in Power BI (2023)
GuyInACube,https://www.youtube.com/watch?v=6RzC1P_1Elg,2023-02-22,How to get a CLOCK in your Power BI Report
GuyInACube,https://www.youtube.com/watch?v=KrsNwegpqlk,2023-02-21,Checking out the Window Clause in Azure SQL and SQL Server 2022
GuyInACube,https://www.youtube.com/watch?v=zI4MV2vNVxY,2023-02-18,"REPLAY Power BI tips from the Pros - LIVE (Feb 18, 2023)"
GuyInACube,https://www.youtube.com/watch?v=58rLq8MF2mc,2023-02-15,Publish/Migrate your RDL files from Power BI Report Server to the service
GuyInACube,https://www.youtube.com/watch?v=6KG-LogdI9g,2023-02-14,Provide data lake access with Azure Synapse Analytics
GuyInACube,https://www.youtube.com/watch?v=XPuGOZdxX5s,2023-02-11,"REPLAY Power BI tips from the Pros - LIVE (Feb 11, 2023)"
GuyInACube,https://www.youtube.com/watch?v=cqqyAy5Cemc,2023-02-10,An Ode to a Pie Chart by ChatGPT
GuyInACube,https://www.youtube.com/watch?v=wd2c1sjTENQ,2023-02-09,Guy in a Cube answers the web&#39;s most searched questions on Power BI
GuyInACube,https://www.youtube.com/watch?v=WXpxNpnE3D4,2023-02-08,Time to look at the new INDEX function in DAX and Power BI
GuyInACube,https://www.youtube.com/watch?v=ZKvpiOnwAK4,2023-02-07,Continuing the T-SQL journey with OVER and RANK
